09:57:10.195480 IP 165.22.226.164.34038 > 104.248.106.12.https: Flags [P.], seq 3888723944:3888723983, ack 2865132680, win 2261, options [nop,nop,TS val 611243113 ecr 3723166387], length 39
09:57:10.197241 IP 104.248.106.12.https > 165.22.226.164.34038: Flags [P.], seq 1:40, ack 39, win 501, options [nop,nop,TS val 3723196390 ecr 611243113], length 39
09:57:10.197278 IP 165.22.226.164.34038 > 104.248.106.12.https: Flags [.], ack 40, win 2261, options [nop,nop,TS val 611243115 ecr 3723196390], length 0
09:57:10.894881 IP 104.248.106.12.https > 165.22.226.164.34038: Flags [P.], seq 40:183, ack 39, win 501, options [nop,nop,TS val 3723197087 ecr 611243115], length 143
09:57:10.894943 IP 165.22.226.164.34038 > 104.248.106.12.https: Flags [.], ack 183, win 2261, options [nop,nop,TS val 611243813 ecr 3723197087], length 0
09:57:11.006145 IP 165.22.226.164.38838 > 67.207.67.3.domain: 36941+ PTR? 12.106.248.104.in-addr.arpa. (45)
09:57:11.030451 IP 165.22.226.164.58230 > 104.248.106.12.8999: Flags [P.], seq 1095334343:1095334384, ack 2172813109, win 2533, options [nop,nop,TS val 611243948 ecr 1360663879], length 41
09:57:11.030586 IP 165.22.226.164.58230 > 104.248.106.12.8999: Flags [P.], seq 41:425, ack 1, win 2533, options [nop,nop,TS val 611243948 ecr 1360663879], length 384
09:57:11.030980 IP 104.248.106.12.8999 > 165.22.226.164.58230: Flags [.], ack 425, win 6204, options [nop,nop,TS val 1360674746 ecr 611243948], length 0
09:57:11.040535 IP 104.248.106.12.8999 > 165.22.226.164.58230: Flags [P.], seq 1:36, ack 425, win 6204, options [nop,nop,TS val 1360674755 ecr 611243948], length 35
09:57:11.040577 IP 165.22.226.164.58230 > 104.248.106.12.8999: Flags [.], ack 36, win 2533, options [nop,nop,TS val 611243958 ecr 1360674755], length 0
09:57:11.040829 IP 104.248.106.12.8999 > 165.22.226.164.58230: Flags [P.], seq 36:1091, ack 425, win 6204, options [nop,nop,TS val 1360674756 ecr 611243948], length 1055
09:57:11.040839 IP 165.22.226.164.58230 > 104.248.106.12.8999: Flags [.], ack 1091, win 2531, options [nop,nop,TS val 611243959 ecr 1360674756], length 0
09:57:11.088486 IP 67.207.67.3.domain > 165.22.226.164.38838: 36941 NXDomain 0/1/0 (112)
09:57:11.088746 IP 165.22.226.164.42406 > 67.207.67.3.domain: 53273+ PTR? 164.226.22.165.in-addr.arpa. (45)
09:57:11.121216 IP 67.207.67.3.domain > 165.22.226.164.42406: 53273 NXDomain 0/1/0 (112)
09:57:11.183190 IP 165.22.226.164.33010 > 104.248.106.12.https: Flags [P.], seq 302324247:302324286, ack 2502588536, win 501, options [nop,nop,TS val 611244101 ecr 3723195365], length 39
09:57:11.190557 IP 104.248.106.12.https > 165.22.226.164.33010: Flags [P.], seq 1:542, ack 39, win 6163, options [nop,nop,TS val 3723197383 ecr 611244101], length 541
09:57:11.191299 IP 165.22.226.164.33010 > 104.248.106.12.https: Flags [P.], seq 39:80, ack 542, win 501, options [nop,nop,TS val 611244109 ecr 3723197383], length 41
09:57:11.191349 IP 165.22.226.164.33010 > 104.248.106.12.https: Flags [P.], seq 80:530, ack 542, win 501, options [nop,nop,TS val 611244109 ecr 3723197383], length 450
09:57:11.191829 IP 104.248.106.12.https > 165.22.226.164.33010: Flags [.], ack 530, win 6163, options [nop,nop,TS val 3723197384 ecr 611244109], length 0
09:57:11.193319 IP 104.248.106.12.https > 165.22.226.164.33010: Flags [P.], seq 542:577, ack 530, win 6163, options [nop,nop,TS val 3723197386 ecr 611244109], length 35
09:57:11.198412 IP 104.248.106.12.https > 165.22.226.164.33010: Flags [P.], seq 577:1096, ack 530, win 6163, options [nop,nop,TS val 3723197391 ecr 611244109], length 519
09:57:11.198520 IP 165.22.226.164.33010 > 104.248.106.12.https: Flags [.], ack 1096, win 501, options [nop,nop,TS val 611244116 ecr 3723197386], length 0
09:57:11.487636 IP 165.22.226.164.58230 > 104.248.106.12.8999: Flags [P.], seq 425:466, ack 1091, win 2533, options [nop,nop,TS val 611244406 ecr 1360674756], length 41
09:57:11.487765 IP 165.22.226.164.58230 > 104.248.106.12.8999: Flags [P.], seq 466:925, ack 1091, win 2533, options [nop,nop,TS val 611244406 ecr 1360674756], length 459
09:57:11.488198 IP 104.248.106.12.8999 > 165.22.226.164.58230: Flags [.], ack 925, win 6204, options [nop,nop,TS val 1360675203 ecr 611244406], length 0
09:57:11.490933 IP 104.248.106.12.8999 > 165.22.226.164.58230: Flags [P.], seq 1091:1126, ack 925, win 6204, options [nop,nop,TS val 1360675206 ecr 611244406], length 35
09:57:11.490971 IP 165.22.226.164.58230 > 104.248.106.12.8999: Flags [.], ack 1126, win 2533, options [nop,nop,TS val 611244409 ecr 1360675206], length 0
09:57:11.491459 IP 104.248.106.12.8999 > 165.22.226.164.58230: Flags [P.], seq 1126:2197, ack 925, win 6204, options [nop,nop,TS val 1360675206 ecr 611244409], length 1071
09:57:11.491480 IP 165.22.226.164.58230 > 104.248.106.12.8999: Flags [.], ack 2197, win 2533, options [nop,nop,TS val 611244409 ecr 1360675206], length 0
09:57:12.029677 IP 165.22.226.164.56431 > 67.207.67.3.domain: 24110+ PTR? 3.67.207.67.in-addr.arpa. (42)
09:57:12.030270 IP 67.207.67.3.domain > 165.22.226.164.56431: 24110 NXDomain 0/1/0 (109)
09:57:12.395071 IP 104.248.106.12.https > 165.22.226.164.32990: Flags [P.], seq 748647751:748647854, ack 4243334099, win 6513, options [nop,nop,TS val 2442169188 ecr 611240542], length 103
09:57:12.395109 IP 165.22.226.164.32990 > 104.248.106.12.https: Flags [.], ack 103, win 10412, options [nop,nop,TS val 611245313 ecr 2442169188], length 0
09:57:12.911222 IP 104.248.106.12.https > 165.22.226.164.49554: Flags [P.], seq 3521218826:3521218969, ack 3023443466, win 501, options [nop,nop,TS val 2442169704 ecr 611221419], length 143
09:57:12.911277 IP 165.22.226.164.49554 > 104.248.106.12.https: Flags [.], ack 143, win 9013, options [nop,nop,TS val 611245829 ecr 2442169704], length 0
09:57:13.162217 IP 104.248.106.12.https > 165.22.226.164.33030: Flags [P.], seq 4002295858:4002295981, ack 1812878009, win 501, options [nop,nop,TS val 3057391529 ecr 611237713], length 123
09:57:13.162278 IP 165.22.226.164.33030 > 104.248.106.12.https: Flags [.], ack 123, win 3071, options [nop,nop,TS val 611246080 ecr 3057391529], length 0
09:57:13.186985 IP 165.22.226.164.34032 > 104.248.106.12.https: Flags [P.], seq 60789389:60789428, ack 246276097, win 586, options [nop,nop,TS val 611246105 ecr 3429993590], length 39
09:57:13.189421 IP 104.248.106.12.https > 165.22.226.164.34032: Flags [P.], seq 1:40, ack 39, win 501, options [nop,nop,TS val 3430023593 ecr 611246105], length 39
09:57:13.189480 IP 165.22.226.164.34032 > 104.248.106.12.https: Flags [.], ack 40, win 586, options [nop,nop,TS val 611246107 ecr 3430023593], length 0
09:57:13.199299 IP 165.22.226.164.33010 > 104.248.106.12.https: Flags [P.], seq 530:569, ack 1096, win 501, options [nop,nop,TS val 611246117 ecr 3723197386], length 39
09:57:13.206414 IP 104.248.106.12.https > 165.22.226.164.33010: Flags [P.], seq 1096:1636, ack 569, win 6163, options [nop,nop,TS val 3723199399 ecr 611246117], length 540
09:57:13.207097 IP 165.22.226.164.33010 > 104.248.106.12.https: Flags [P.], seq 569:610, ack 1636, win 501, options [nop,nop,TS val 611246125 ecr 3723199399], length 41
09:57:13.207138 IP 165.22.226.164.33010 > 104.248.106.12.https: Flags [P.], seq 610:1060, ack 1636, win 501, options [nop,nop,TS val 611246125 ecr 3723199399], length 450
09:57:13.207644 IP 104.248.106.12.https > 165.22.226.164.33010: Flags [.], ack 1060, win 6163, options [nop,nop,TS val 3723199400 ecr 611246125], length 0
09:57:13.210546 IP 104.248.106.12.https > 165.22.226.164.33010: Flags [P.], seq 1636:1671, ack 1060, win 6163, options [nop,nop,TS val 3723199403 ecr 611246125], length 35
09:57:13.213688 IP 104.248.106.12.https > 165.22.226.164.33010: Flags [P.], seq 1671:2190, ack 1060, win 6163, options [nop,nop,TS val 3723199406 ecr 611246125], length 519
09:57:13.213765 IP 165.22.226.164.33010 > 104.248.106.12.https: Flags [.], ack 2190, win 501, options [nop,nop,TS val 611246132 ecr 3723199403], length 0
09:57:13.574999 IP 104.248.106.12.https > 165.22.226.164.32990: Flags [P.], seq 103:206, ack 1, win 6513, options [nop,nop,TS val 2442170368 ecr 611245313], length 103
09:57:13.575052 IP 165.22.226.164.32990 > 104.248.106.12.https: Flags [.], ack 206, win 10412, options [nop,nop,TS val 611246493 ecr 2442170368], length 0
09:57:13.863737 IP 104.248.106.12.8132 > 165.22.226.164.38068: Flags [P.], seq 1558138625:1558138703, ack 248612177, win 2577, options [nop,nop,TS val 3057392231 ecr 253356243], length 78
09:57:13.864794 IP 165.22.226.164.38068 > 104.248.106.12.8132: Flags [P.], seq 1:53, ack 78, win 501, options [nop,nop,TS val 253361127 ecr 3057392231], length 52
09:57:13.865146 IP 165.22.226.164.38068 > 104.248.106.12.8132: Flags [P.], seq 53:131, ack 78, win 501, options [nop,nop,TS val 253361127 ecr 3057392231], length 78
09:57:13.865413 IP 104.248.106.12.8132 > 165.22.226.164.38068: Flags [.], ack 53, win 2577, options [nop,nop,TS val 3057392232 ecr 253361127], length 0
09:57:13.865586 IP 104.248.106.12.8132 > 165.22.226.164.38068: Flags [.], ack 131, win 2577, options [nop,nop,TS val 3057392233 ecr 253361127], length 0
09:57:13.867410 IP 104.248.106.12.8132 > 165.22.226.164.38068: Flags [P.], seq 78:147, ack 131, win 2577, options [nop,nop,TS val 3057392234 ecr 253361127], length 69
09:57:13.867544 IP 165.22.226.164.38068 > 104.248.106.12.8132: Flags [P.], seq 131:170, ack 147, win 501, options [nop,nop,TS val 253361129 ecr 3057392234], length 39
09:57:13.909347 IP 104.248.106.12.8132 > 165.22.226.164.38068: Flags [.], ack 170, win 2577, options [nop,nop,TS val 3057392276 ecr 253361129], length 0
09:57:14.254275 IP 104.248.106.12.https > 165.22.226.164.33030: Flags [P.], seq 123:246, ack 1, win 501, options [nop,nop,TS val 3057392621 ecr 611246080], length 123
09:57:14.254328 IP 165.22.226.164.33030 > 104.248.106.12.https: Flags [.], ack 246, win 3071, options [nop,nop,TS val 611247172 ecr 3057392621], length 0
09:57:15.215093 IP 165.22.226.164.33010 > 104.248.106.12.https: Flags [P.], seq 1060:1099, ack 2190, win 501, options [nop,nop,TS val 611248133 ecr 3723199403], length 39
09:57:15.221451 IP 104.248.106.12.https > 165.22.226.164.33010: Flags [P.], seq 2190:2730, ack 1099, win 6163, options [nop,nop,TS val 3723201414 ecr 611248133], length 540
09:57:15.222091 IP 165.22.226.164.33010 > 104.248.106.12.https: Flags [P.], seq 1099:1140, ack 2730, win 501, options [nop,nop,TS val 611248140 ecr 3723201414], length 41
09:57:15.222143 IP 165.22.226.164.33010 > 104.248.106.12.https: Flags [P.], seq 1140:1590, ack 2730, win 501, options [nop,nop,TS val 611248140 ecr 3723201414], length 450
09:57:15.222548 IP 104.248.106.12.https > 165.22.226.164.33010: Flags [.], ack 1590, win 6163, options [nop,nop,TS val 3723201415 ecr 611248140], length 0
09:57:15.224179 IP 104.248.106.12.https > 165.22.226.164.33010: Flags [P.], seq 2730:2765, ack 1590, win 6163, options [nop,nop,TS val 3723201417 ecr 611248140], length 35
09:57:15.227908 IP 104.248.106.12.https > 165.22.226.164.33010: Flags [P.], seq 2765:3284, ack 1590, win 6163, options [nop,nop,TS val 3723201420 ecr 611248140], length 519
09:57:15.228014 IP 165.22.226.164.33010 > 104.248.106.12.https: Flags [.], ack 3284, win 501, options [nop,nop,TS val 611248146 ecr 3723201417], length 0
09:57:15.837509 IP 104.248.106.12.https > 165.22.226.164.32990: Flags [P.], seq 206:309, ack 1, win 6513, options [nop,nop,TS val 2442172631 ecr 611246493], length 103
09:57:15.837557 IP 165.22.226.164.32990 > 104.248.106.12.https: Flags [.], ack 309, win 10412, options [nop,nop,TS val 611248755 ecr 2442172631], length 0
09:57:15.866608 IP 104.248.106.12.https > 165.22.226.164.33030: Flags [P.], seq 246:277, ack 1, win 501, options [nop,nop,TS val 3057394233 ecr 611247172], length 31
09:57:15.866651 IP 165.22.226.164.33030 > 104.248.106.12.https: Flags [.], ack 277, win 3071, options [nop,nop,TS val 611248785 ecr 3057394233], length 0
09:57:15.867166 IP 165.22.226.164.33030 > 104.248.106.12.https: Flags [P.], seq 1:307, ack 277, win 3071, options [nop,nop,TS val 611248785 ecr 3057394233], length 306
09:57:15.870846 IP 104.248.106.12.https > 165.22.226.164.33030: Flags [P.], seq 277:366, ack 307, win 501, options [nop,nop,TS val 3057394238 ecr 611248785], length 89
09:57:15.870886 IP 165.22.226.164.33030 > 104.248.106.12.https: Flags [.], ack 366, win 3071, options [nop,nop,TS val 611248789 ecr 3057394238], length 0
09:57:16.218612 IP 104.248.106.12.https > 165.22.226.164.49554: Flags [P.], seq 143:286, ack 1, win 501, options [nop,nop,TS val 2442173012 ecr 611245829], length 143
09:57:16.218721 IP 165.22.226.164.49554 > 104.248.106.12.https: Flags [.], ack 286, win 9013, options [nop,nop,TS val 611249137 ecr 2442173012], length 0
09:57:17.228667 IP 165.22.226.164.33010 > 104.248.106.12.https: Flags [P.], seq 1590:1629, ack 3284, win 501, options [nop,nop,TS val 611250147 ecr 3723201417], length 39
09:57:17.234561 IP 104.248.106.12.https > 165.22.226.164.33010: Flags [P.], seq 3284:3824, ack 1629, win 6163, options [nop,nop,TS val 3723203427 ecr 611250147], length 540
09:57:17.235732 IP 165.22.226.164.33010 > 104.248.106.12.https: Flags [P.], seq 1629:1670, ack 3824, win 501, options [nop,nop,TS val 611250154 ecr 3723203427], length 41
09:57:17.235778 IP 165.22.226.164.33010 > 104.248.106.12.https: Flags [P.], seq 1670:2120, ack 3824, win 501, options [nop,nop,TS val 611250154 ecr 3723203427], length 450
09:57:17.236243 IP 104.248.106.12.https > 165.22.226.164.33010: Flags [.], ack 2120, win 6163, options [nop,nop,TS val 3723203429 ecr 611250154], length 0
09:57:17.238842 IP 104.248.106.12.https > 165.22.226.164.33010: Flags [P.], seq 3824:3859, ack 2120, win 6163, options [nop,nop,TS val 3723203431 ecr 611250154], length 35
09:57:17.242818 IP 104.248.106.12.https > 165.22.226.164.33010: Flags [P.], seq 3859:4378, ack 2120, win 6163, options [nop,nop,TS val 3723203435 ecr 611250154], length 519
09:57:17.242941 IP 165.22.226.164.33010 > 104.248.106.12.https: Flags [.], ack 4378, win 501, options [nop,nop,TS val 611250161 ecr 3723203431], length 0
09:57:17.695815 IP 165.22.226.164.32990 > 104.248.106.12.https: Flags [P.], seq 1:39, ack 309, win 10412, options [nop,nop,TS val 611250614 ecr 2442172631], length 38
09:57:17.700054 IP 104.248.106.12.https > 165.22.226.164.32990: Flags [P.], seq 309:7836, ack 39, win 6513, options [nop,nop,TS val 2442174493 ecr 611250614], length 7527
09:57:17.700054 IP 104.248.106.12.https > 165.22.226.164.32990: Flags [P.], seq 7836:7867, ack 39, win 6513, options [nop,nop,TS val 2442174493 ecr 611250614], length 31
09:57:17.700125 IP 165.22.226.164.32990 > 104.248.106.12.https: Flags [.], ack 7836, win 10386, options [nop,nop,TS val 611250618 ecr 2442174493], length 0
09:57:17.700141 IP 165.22.226.164.32990 > 104.248.106.12.https: Flags [.], ack 7867, win 10386, options [nop,nop,TS val 611250618 ecr 2442174493], length 0
09:57:17.700378 IP 165.22.226.164.32990 > 104.248.106.12.https: Flags [P.], seq 39:74, ack 7867, win 10412, options [nop,nop,TS val 611250618 ecr 2442174493], length 35
09:57:17.744573 IP 104.248.106.12.https > 165.22.226.164.32990: Flags [.], ack 74, win 6513, options [nop,nop,TS val 2442174538 ecr 611250618], length 0
09:57:17.810226 IP 165.22.226.164.33008 > 104.248.106.12.https: Flags [P.], seq 1484351084:1484351123, ack 2514019132, win 1623, options [nop,nop,TS val 611250728 ecr 2638295563], length 39
09:57:17.817052 IP 104.248.106.12.https > 165.22.226.164.33008: Flags [P.], seq 1:125, ack 39, win 501, options [nop,nop,TS val 2638305133 ecr 611250728], length 124
09:57:17.817099 IP 165.22.226.164.33008 > 104.248.106.12.https: Flags [.], ack 125, win 1623, options [nop,nop,TS val 611250735 ecr 2638305133], length 0
09:57:17.852754 IP 104.248.106.12.https > 165.22.226.164.32990: Flags [P.], seq 7867:7970, ack 74, win 6513, options [nop,nop,TS val 2442174646 ecr 611250618], length 103
09:57:17.852798 IP 165.22.226.164.32990 > 104.248.106.12.https: Flags [.], ack 7970, win 10412, options [nop,nop,TS val 611250771 ecr 2442174646], length 0
09:57:17.987434 IP 165.22.226.164.32990 > 104.248.106.12.https: Flags [P.], seq 74:114, ack 7970, win 10412, options [nop,nop,TS val 611250905 ecr 2442174646], length 40
09:57:17.987467 IP 165.22.226.164.32990 > 104.248.106.12.https: Flags [P.], seq 114:656, ack 7970, win 10412, options [nop,nop,TS val 611250905 ecr 2442174646], length 542
09:57:17.987855 IP 104.248.106.12.https > 165.22.226.164.32990: Flags [.], ack 114, win 6513, options [nop,nop,TS val 2442174781 ecr 611250905], length 0
09:57:17.987887 IP 104.248.106.12.https > 165.22.226.164.32990: Flags [.], ack 656, win 6513, options [nop,nop,TS val 2442174781 ecr 611250905], length 0
09:57:17.990424 IP 104.248.106.12.https > 165.22.226.164.32990: Flags [P.], seq 7970:8005, ack 656, win 6513, options [nop,nop,TS val 2442174784 ecr 611250905], length 35
09:57:17.990465 IP 165.22.226.164.32990 > 104.248.106.12.https: Flags [.], ack 8005, win 10412, options [nop,nop,TS val 611250908 ecr 2442174784], length 0
09:57:17.995841 IP 104.248.106.12.https > 165.22.226.164.32990: Flags [P.], seq 8005:8614, ack 656, win 6513, options [nop,nop,TS val 2442174789 ecr 611250908], length 609
09:57:17.995893 IP 165.22.226.164.32990 > 104.248.106.12.https: Flags [.], ack 8614, win 10412, options [nop,nop,TS val 611250914 ecr 2442174789], length 0
09:57:18.177793 IP 165.22.226.164.34034 > 104.248.106.12.https: Flags [P.], seq 3850775644:3850775683, ack 1492166580, win 501, options [nop,nop,TS val 611251096 ecr 2638275492], length 39
09:57:18.180129 IP 104.248.106.12.https > 165.22.226.164.34034: Flags [P.], seq 1:40, ack 39, win 501, options [nop,nop,TS val 2638305496 ecr 611251096], length 39
09:57:18.180168 IP 165.22.226.164.34034 > 104.248.106.12.https: Flags [.], ack 40, win 501, options [nop,nop,TS val 611251098 ecr 2638305496], length 0
09:57:18.243515 IP 165.22.226.164.33008 > 104.248.106.12.https: Flags [P.], seq 39:78, ack 125, win 1623, options [nop,nop,TS val 611251161 ecr 2638305133], length 39
09:57:18.248308 IP 104.248.106.12.https > 165.22.226.164.33008: Flags [P.], seq 125:509, ack 78, win 501, options [nop,nop,TS val 2638305564 ecr 611251161], length 384
09:57:18.248351 IP 165.22.226.164.33008 > 104.248.106.12.https: Flags [.], ack 509, win 1623, options [nop,nop,TS val 611251166 ecr 2638305564], length 0
09:57:18.697690 IP 165.22.226.164.49550 > 104.248.106.12.https: Flags [P.], seq 2052056291:2052056330, ack 1098398690, win 501, options [nop,nop,TS val 611251616 ecr 3429999100], length 39
09:57:18.700071 IP 104.248.106.12.https > 165.22.226.164.49550: Flags [P.], seq 1:40, ack 39, win 501, options [nop,nop,TS val 3430029104 ecr 611251616], length 39
09:57:18.700125 IP 165.22.226.164.49550 > 104.248.106.12.https: Flags [.], ack 40, win 501, options [nop,nop,TS val 611251618 ecr 3430029104], length 0
09:57:18.851506 IP 104.248.106.12.8132 > 165.22.226.164.38068: Flags [P.], seq 147:225, ack 170, win 2577, options [nop,nop,TS val 3057397218 ecr 253361129], length 78
09:57:18.852858 IP 165.22.226.164.38068 > 104.248.106.12.8132: Flags [P.], seq 170:222, ack 225, win 501, options [nop,nop,TS val 253366115 ecr 3057397218], length 52
09:57:18.853118 IP 165.22.226.164.38068 > 104.248.106.12.8132: Flags [P.], seq 222:300, ack 225, win 501, options [nop,nop,TS val 253366115 ecr 3057397218], length 78
09:57:18.853568 IP 104.248.106.12.8132 > 165.22.226.164.38068: Flags [.], ack 222, win 2577, options [nop,nop,TS val 3057397220 ecr 253366115], length 0
09:57:18.853602 IP 104.248.106.12.8132 > 165.22.226.164.38068: Flags [.], ack 300, win 2577, options [nop,nop,TS val 3057397221 ecr 253366115], length 0
09:57:18.855002 IP 104.248.106.12.8132 > 165.22.226.164.38068: Flags [P.], seq 225:294, ack 300, win 2577, options [nop,nop,TS val 3057397222 ecr 253366115], length 69
09:57:18.855159 IP 165.22.226.164.38068 > 104.248.106.12.8132: Flags [P.], seq 300:339, ack 294, win 501, options [nop,nop,TS val 253366117 ecr 3057397222], length 39
09:57:18.855745 IP 104.248.106.12.8132 > 165.22.226.164.38068: Flags [.], ack 339, win 2577, options [nop,nop,TS val 3057397223 ecr 253366117], length 0
09:57:19.243608 IP 165.22.226.164.33010 > 104.248.106.12.https: Flags [P.], seq 2120:2159, ack 4378, win 501, options [nop,nop,TS val 611252161 ecr 3723203431], length 39
09:57:19.249339 IP 104.248.106.12.https > 165.22.226.164.33010: Flags [P.], seq 4378:4919, ack 2159, win 6163, options [nop,nop,TS val 3723205442 ecr 611252161], length 541
09:57:19.250027 IP 165.22.226.164.33010 > 104.248.106.12.https: Flags [P.], seq 2159:2200, ack 4919, win 501, options [nop,nop,TS val 611252168 ecr 3723205442], length 41
09:57:19.250074 IP 165.22.226.164.33010 > 104.248.106.12.https: Flags [P.], seq 2200:2650, ack 4919, win 501, options [nop,nop,TS val 611252168 ecr 3723205442], length 450
09:57:19.250503 IP 104.248.106.12.https > 165.22.226.164.33010: Flags [.], ack 2650, win 6163, options [nop,nop,TS val 3723205443 ecr 611252168], length 0
09:57:19.252114 IP 104.248.106.12.https > 165.22.226.164.33010: Flags [P.], seq 4919:4954, ack 2650, win 6163, options [nop,nop,TS val 3723205445 ecr 611252168], length 35
09:57:19.255916 IP 104.248.106.12.https > 165.22.226.164.33010: Flags [P.], seq 4954:5473, ack 2650, win 6163, options [nop,nop,TS val 3723205448 ecr 611252168], length 519
09:57:19.256022 IP 165.22.226.164.33010 > 104.248.106.12.https: Flags [.], ack 5473, win 501, options [nop,nop,TS val 611252174 ecr 3723205445], length 0
09:57:19.285303 IP 104.248.106.12.8132 > 165.22.226.164.38068: Flags [P.], seq 294:687, ack 339, win 2577, options [nop,nop,TS val 3057397652 ecr 253366117], length 393
09:57:19.288144 IP 165.22.226.164.38068 > 104.248.106.12.8132: Flags [P.], seq 339:391, ack 687, win 501, options [nop,nop,TS val 253366550 ecr 3057397652], length 52
09:57:19.288786 IP 104.248.106.12.8132 > 165.22.226.164.38068: Flags [.], ack 391, win 2577, options [nop,nop,TS val 3057397656 ecr 253366550], length 0
09:57:19.290072 IP 165.22.226.164.38068 > 104.248.106.12.8132: Flags [P.], seq 391:588, ack 687, win 501, options [nop,nop,TS val 253366552 ecr 3057397656], length 197
09:57:19.290592 IP 104.248.106.12.8132 > 165.22.226.164.38068: Flags [.], ack 588, win 2576, options [nop,nop,TS val 3057397658 ecr 253366552], length 0
09:57:19.291391 IP 165.22.226.164.38068 > 104.248.106.12.8132: Flags [P.], seq 588:1149, ack 687, win 501, options [nop,nop,TS val 253366553 ecr 3057397658], length 561
09:57:19.291768 IP 165.22.226.164.38068 > 104.248.106.12.8132: Flags [P.], seq 1149:2487, ack 687, win 501, options [nop,nop,TS val 253366554 ecr 3057397658], length 1338
09:57:19.291933 IP 104.248.106.12.8132 > 165.22.226.164.38068: Flags [.], ack 1149, win 2572, options [nop,nop,TS val 3057397659 ecr 253366553], length 0
09:57:19.292218 IP 104.248.106.12.8132 > 165.22.226.164.38068: Flags [.], ack 2487, win 2568, options [nop,nop,TS val 3057397659 ecr 253366554], length 0
09:57:19.296704 IP 104.248.106.12.8132 > 165.22.226.164.38068: Flags [P.], seq 687:817, ack 2487, win 2577, options [nop,nop,TS val 3057397664 ecr 253366554], length 130
09:57:19.297466 IP 165.22.226.164.38068 > 104.248.106.12.8132: Flags [P.], seq 2487:2526, ack 817, win 501, options [nop,nop,TS val 253366559 ecr 3057397664], length 39
09:57:19.297849 IP 104.248.106.12.8132 > 165.22.226.164.38068: Flags [P.], seq 817:1168, ack 2487, win 2577, options [nop,nop,TS val 3057397665 ecr 253366554], length 351
09:57:19.297962 IP 165.22.226.164.38068 > 104.248.106.12.8132: Flags [P.], seq 2526:2609, ack 1168, win 501, options [nop,nop,TS val 253366560 ecr 3057397665], length 83
09:57:19.298005 IP 104.248.106.12.8132 > 165.22.226.164.38068: Flags [.], ack 2526, win 2577, options [nop,nop,TS val 3057397665 ecr 253366559], length 0
09:57:19.298432 IP 104.248.106.12.8132 > 165.22.226.164.38068: Flags [.], ack 2609, win 2577, options [nop,nop,TS val 3057397665 ecr 253366560], length 0
09:57:19.299511 IP 165.22.226.164.38068 > 104.248.106.12.8132: Flags [P.], seq 2609:2661, ack 1168, win 501, options [nop,nop,TS val 253366561 ecr 3057397665], length 52
09:57:19.299590 IP 104.248.106.12.8132 > 165.22.226.164.38068: Flags [P.], seq 1168:1220, ack 2609, win 2577, options [nop,nop,TS val 3057397667 ecr 253366560], length 52
09:57:19.299765 IP 165.22.226.164.38068 > 104.248.106.12.8132: Flags [P.], seq 2661:2700, ack 1220, win 501, options [nop,nop,TS val 253366562 ecr 3057397667], length 39
09:57:19.300074 IP 104.248.106.12.8132 > 165.22.226.164.38068: Flags [.], ack 2661, win 2577, options [nop,nop,TS val 3057397667 ecr 253366561], length 0
09:57:19.300135 IP 104.248.106.12.8132 > 165.22.226.164.38068: Flags [.], ack 2700, win 2577, options [nop,nop,TS val 3057397667 ecr 253366562], length 0
09:57:19.301882 IP 104.248.106.12.8132 > 165.22.226.164.38068: Flags [P.], seq 1220:1259, ack 2700, win 2577, options [nop,nop,TS val 3057397669 ecr 253366562], length 39
09:57:19.345546 IP 165.22.226.164.38068 > 104.248.106.12.8132: Flags [.], ack 1259, win 501, options [nop,nop,TS val 253366607 ecr 3057397669], length 0
09:57:20.182768 IP 104.248.106.12.8999 > 165.22.226.164.58230: Flags [P.], seq 2197:2362, ack 925, win 6204, options [nop,nop,TS val 1360683898 ecr 611244409], length 165
09:57:20.182817 IP 165.22.226.164.58230 > 104.248.106.12.8999: Flags [.], ack 2362, win 2533, options [nop,nop,TS val 611253101 ecr 1360683898], length 0
09:57:20.904774 IP 165.22.226.164.34024 > 104.248.106.12.https: Flags [P.], seq 2123041979:2123042018, ack 75706023, win 1180, options [nop,nop,TS val 611253823 ecr 3723177139], length 39
09:57:20.905502 IP 104.248.106.12.https > 165.22.226.164.34024: Flags [.], ack 39, win 501, options [nop,nop,TS val 3723207098 ecr 611253823], length 0
09:57:20.906757 IP 104.248.106.12.https > 165.22.226.164.34024: Flags [P.], seq 1:40, ack 39, win 501, options [nop,nop,TS val 3723207099 ecr 611253823], length 39
09:57:20.949559 IP 165.22.226.164.34024 > 104.248.106.12.https: Flags [.], ack 40, win 1180, options [nop,nop,TS val 611253867 ecr 3723207099], length 0
09:57:21.256680 IP 165.22.226.164.33010 > 104.248.106.12.https: Flags [P.], seq 2650:2689, ack 5473, win 501, options [nop,nop,TS val 611254175 ecr 3723205445], length 39
09:57:21.263118 IP 104.248.106.12.https > 165.22.226.164.33010: Flags [P.], seq 5473:6014, ack 2689, win 6163, options [nop,nop,TS val 3723207455 ecr 611254175], length 541
09:57:21.263794 IP 165.22.226.164.33010 > 104.248.106.12.https: Flags [P.], seq 2689:2730, ack 6014, win 501, options [nop,nop,TS val 611254182 ecr 3723207455], length 41
09:57:21.263832 IP 165.22.226.164.33010 > 104.248.106.12.https: Flags [P.], seq 2730:3180, ack 6014, win 501, options [nop,nop,TS val 611254182 ecr 3723207455], length 450
09:57:21.264312 IP 104.248.106.12.https > 165.22.226.164.33010: Flags [.], ack 3180, win 6163, options [nop,nop,TS val 3723207457 ecr 611254182], length 0
09:57:21.267087 IP 104.248.106.12.https > 165.22.226.164.33010: Flags [P.], seq 6014:6049, ack 3180, win 6163, options [nop,nop,TS val 3723207459 ecr 611254182], length 35
09:57:21.270915 IP 104.248.106.12.https > 165.22.226.164.33010: Flags [P.], seq 6049:6568, ack 3180, win 6163, options [nop,nop,TS val 3723207463 ecr 611254182], length 519
09:57:21.271011 IP 165.22.226.164.33010 > 104.248.106.12.https: Flags [.], ack 6568, win 501, options [nop,nop,TS val 611254189 ecr 3723207459], length 0
09:57:21.407856 IP 165.22.226.164.58230 > 104.248.106.12.8999: Flags [P.], seq 925:966, ack 2362, win 2533, options [nop,nop,TS val 611254326 ecr 1360683898], length 41
09:57:21.408043 IP 165.22.226.164.58230 > 104.248.106.12.8999: Flags [P.], seq 966:1383, ack 2362, win 2533, options [nop,nop,TS val 611254326 ecr 1360683898], length 417
09:57:21.408489 IP 104.248.106.12.8999 > 165.22.226.164.58230: Flags [.], ack 1383, win 6204, options [nop,nop,TS val 1360685123 ecr 611254326], length 0
09:57:21.409045 IP 165.22.226.164.58230 > 104.248.106.12.8999: Flags [P.], seq 1383:1424, ack 2362, win 2533, options [nop,nop,TS val 611254327 ecr 1360685123], length 41
09:57:21.409127 IP 165.22.226.164.58230 > 104.248.106.12.8999: Flags [P.], seq 1424:1840, ack 2362, win 2533, options [nop,nop,TS val 611254327 ecr 1360685123], length 416
09:57:21.409574 IP 104.248.106.12.8999 > 165.22.226.164.58230: Flags [.], ack 1840, win 6204, options [nop,nop,TS val 1360685125 ecr 611254327], length 0
09:57:21.418343 IP 104.248.106.12.8999 > 165.22.226.164.58230: Flags [P.], seq 2362:4214, ack 1840, win 6204, options [nop,nop,TS val 1360685133 ecr 611254327], length 1852
09:57:21.418432 IP 165.22.226.164.58230 > 104.248.106.12.8999: Flags [.], ack 4214, win 2527, options [nop,nop,TS val 611254336 ecr 1360685133], length 0
09:57:21.886106 IP 165.22.226.164.34026 > 104.248.106.12.https: Flags [P.], seq 3282359182:3282359221, ack 714532876, win 501, options [nop,nop,TS val 611254804 ecr 1360655601], length 39
09:57:21.886735 IP 104.248.106.12.https > 165.22.226.164.34026: Flags [.], ack 39, win 501, options [nop,nop,TS val 1360685602 ecr 611254804], length 0
09:57:21.887724 IP 104.248.106.12.https > 165.22.226.164.34026: Flags [P.], seq 1:40, ack 39, win 501, options [nop,nop,TS val 1360685603 ecr 611254804], length 39
09:57:21.887759 IP 165.22.226.164.34026 > 104.248.106.12.https: Flags [.], ack 40, win 501, options [nop,nop,TS val 611254806 ecr 1360685603], length 0
09:57:22.070800 IP 165.22.226.164.58230 > 104.248.106.12.8999: Flags [P.], seq 1840:1881, ack 4214, win 2533, options [nop,nop,TS val 611254989 ecr 1360685133], length 41
09:57:22.071012 IP 165.22.226.164.58230 > 104.248.106.12.8999: Flags [P.], seq 1881:2265, ack 4214, win 2533, options [nop,nop,TS val 611254989 ecr 1360685133], length 384
09:57:22.071515 IP 104.248.106.12.8999 > 165.22.226.164.58230: Flags [.], ack 2265, win 6204, options [nop,nop,TS val 1360685786 ecr 611254989], length 0
09:57:22.076320 IP 104.248.106.12.8999 > 165.22.226.164.58230: Flags [P.], seq 4214:4249, ack 2265, win 6204, options [nop,nop,TS val 1360685791 ecr 611254989], length 35
09:57:22.076368 IP 165.22.226.164.58230 > 104.248.106.12.8999: Flags [.], ack 4249, win 2533, options [nop,nop,TS val 611254994 ecr 1360685791], length 0
09:57:22.076558 IP 104.248.106.12.8999 > 165.22.226.164.58230: Flags [P.], seq 4249:5188, ack 2265, win 6204, options [nop,nop,TS val 1360685792 ecr 611254989], length 939
09:57:22.076569 IP 165.22.226.164.58230 > 104.248.106.12.8999: Flags [.], ack 5188, win 2533, options [nop,nop,TS val 611254994 ecr 1360685792], length 0
09:57:23.271961 IP 165.22.226.164.33010 > 104.248.106.12.https: Flags [P.], seq 3180:3219, ack 6568, win 501, options [nop,nop,TS val 611256190 ecr 3723207459], length 39
09:57:23.277549 IP 104.248.106.12.https > 165.22.226.164.33010: Flags [P.], seq 6568:7109, ack 3219, win 6163, options [nop,nop,TS val 3723209470 ecr 611256190], length 541
09:57:23.278083 IP 165.22.226.164.33010 > 104.248.106.12.https: Flags [P.], seq 3219:3260, ack 7109, win 501, options [nop,nop,TS val 611256196 ecr 3723209470], length 41
09:57:23.278123 IP 165.22.226.164.33010 > 104.248.106.12.https: Flags [P.], seq 3260:3711, ack 7109, win 501, options [nop,nop,TS val 611256196 ecr 3723209470], length 451
09:57:23.278610 IP 104.248.106.12.https > 165.22.226.164.33010: Flags [.], ack 3711, win 6163, options [nop,nop,TS val 3723209471 ecr 611256196], length 0
09:57:23.280825 IP 104.248.106.12.https > 165.22.226.164.33010: Flags [P.], seq 7109:7144, ack 3711, win 6163, options [nop,nop,TS val 3723209473 ecr 611256196], length 35
09:57:23.284222 IP 104.248.106.12.https > 165.22.226.164.33010: Flags [P.], seq 7144:7667, ack 3711, win 6163, options [nop,nop,TS val 3723209477 ecr 611256196], length 523
09:57:23.284310 IP 165.22.226.164.33010 > 104.248.106.12.https: Flags [.], ack 7667, win 501, options [nop,nop,TS val 611256202 ecr 3723209473], length 0
09:57:23.670009 IP 165.22.226.164.35432 > 104.248.106.12.https: Flags [P.], seq 4067409822:4067409846, ack 3253716056, win 501, options [nop,nop,TS val 611256588 ecr 3057372043], length 24
09:57:23.670069 IP 165.22.226.164.35432 > 104.248.106.12.https: Flags [F.], seq 24, ack 1, win 501, options [nop,nop,TS val 611256588 ecr 3057372043], length 0
09:57:23.670168 IP 104.248.106.12.https > 165.22.226.164.35432: Flags [P.], seq 1:40, ack 0, win 501, options [nop,nop,TS val 3057402037 ecr 611226594], length 39
09:57:23.670208 IP 165.22.226.164.35432 > 104.248.106.12.https: Flags [R], seq 4067409822, win 0, length 0
09:57:23.670633 IP 104.248.106.12.https > 165.22.226.164.35432: Flags [.], ack 25, win 501, options [nop,nop,TS val 3057402038 ecr 611256588], length 0
09:57:23.670722 IP 165.22.226.164.35432 > 104.248.106.12.https: Flags [R], seq 4067409847, win 0, length 0
09:57:23.671547 IP 165.22.226.164.57186 > 67.207.67.3.domain: 28421+ AAAA? 20b32b08-2ec4-4e6f-ac03-aec64d126e1e.k8s.ondigitalocean.com. (77)
09:57:23.671604 IP 165.22.226.164.58153 > 67.207.67.3.domain: 49620+ A? 20b32b08-2ec4-4e6f-ac03-aec64d126e1e.k8s.ondigitalocean.com. (77)
09:57:23.673380 IP 67.207.67.3.domain > 165.22.226.164.57186: 28421 0/1/0 (141)
09:57:23.673434 IP 67.207.67.3.domain > 165.22.226.164.58153: 49620 1/0/0 A 104.248.106.12 (93)
09:57:23.673592 IP 165.22.226.164.56084 > 104.248.106.12.https: Flags [S], seq 2570917656, win 64240, options [mss 1460,sackOK,TS val 611256591 ecr 0,nop,wscale 7], length 0
09:57:23.674628 IP 104.248.106.12.https > 165.22.226.164.56084: Flags [S.], seq 1828668090, ack 2570917657, win 65160, options [mss 1400,sackOK,TS val 2442180468 ecr 611256591,nop,wscale 7], length 0
09:57:23.674734 IP 165.22.226.164.56084 > 104.248.106.12.https: Flags [.], ack 1, win 502, options [nop,nop,TS val 611256593 ecr 2442180468], length 0
09:57:23.674905 IP 165.22.226.164.56084 > 104.248.106.12.https: Flags [P.], seq 1:326, ack 1, win 502, options [nop,nop,TS val 611256593 ecr 2442180468], length 325
09:57:23.675282 IP 104.248.106.12.https > 165.22.226.164.56084: Flags [.], ack 326, win 507, options [nop,nop,TS val 2442180469 ecr 611256593], length 0
09:57:23.680751 IP 104.248.106.12.https > 165.22.226.164.56084: Flags [P.], seq 1:2116, ack 326, win 507, options [nop,nop,TS val 2442180474 ecr 611256593], length 2115
09:57:23.680784 IP 165.22.226.164.56084 > 104.248.106.12.https: Flags [.], ack 2116, win 497, options [nop,nop,TS val 611256599 ecr 2442180474], length 0
09:57:23.681448 IP 165.22.226.164.56084 > 104.248.106.12.https: Flags [P.], seq 326:420, ack 2116, win 501, options [nop,nop,TS val 611256599 ecr 2442180474], length 94
09:57:23.681541 IP 165.22.226.164.56084 > 104.248.106.12.https: Flags [P.], seq 420:506, ack 2116, win 501, options [nop,nop,TS val 611256599 ecr 2442180474], length 86
09:57:23.681672 IP 165.22.226.164.56084 > 104.248.106.12.https: Flags [P.], seq 506:1502, ack 2116, win 501, options [nop,nop,TS val 611256600 ecr 2442180474], length 996
09:57:23.681819 IP 104.248.106.12.https > 165.22.226.164.56084: Flags [.], ack 420, win 507, options [nop,nop,TS val 2442180475 ecr 611256599], length 0
09:57:23.681903 IP 104.248.106.12.https > 165.22.226.164.56084: Flags [.], ack 506, win 507, options [nop,nop,TS val 2442180475 ecr 611256599], length 0
09:57:23.681974 IP 104.248.106.12.https > 165.22.226.164.56084: Flags [.], ack 1502, win 501, options [nop,nop,TS val 2442180475 ecr 611256600], length 0
09:57:23.682538 IP 104.248.106.12.https > 165.22.226.164.56084: Flags [P.], seq 2116:2171, ack 1502, win 501, options [nop,nop,TS val 2442180476 ecr 611256600], length 55
09:57:23.682553 IP 165.22.226.164.56084 > 104.248.106.12.https: Flags [.], ack 2171, win 501, options [nop,nop,TS val 611256600 ecr 2442180476], length 0
09:57:23.682618 IP 104.248.106.12.https > 165.22.226.164.56084: Flags [P.], seq 2171:2215, ack 1502, win 501, options [nop,nop,TS val 2442180476 ecr 611256600], length 44
09:57:23.682623 IP 165.22.226.164.56084 > 104.248.106.12.https: Flags [.], ack 2215, win 501, options [nop,nop,TS val 611256600 ecr 2442180476], length 0
09:57:23.682638 IP 165.22.226.164.56084 > 104.248.106.12.https: Flags [P.], seq 1502:1533, ack 2215, win 501, options [nop,nop,TS val 611256601 ecr 2442180476], length 31
09:57:23.682998 IP 104.248.106.12.https > 165.22.226.164.56084: Flags [.], ack 1533, win 501, options [nop,nop,TS val 2442180476 ecr 611256601], length 0
09:57:23.684475 IP 104.248.106.12.https > 165.22.226.164.56084: Flags [P.], seq 2215:2471, ack 1533, win 501, options [nop,nop,TS val 2442180478 ecr 611256601], length 256
09:57:23.684494 IP 165.22.226.164.56084 > 104.248.106.12.https: Flags [.], ack 2471, win 501, options [nop,nop,TS val 611256602 ecr 2442180478], length 0
09:57:23.684561 IP 104.248.106.12.https > 165.22.226.164.56084: Flags [P.], seq 2471:2504, ack 1533, win 501, options [nop,nop,TS val 2442180478 ecr 611256601], length 33
09:57:23.684567 IP 165.22.226.164.56084 > 104.248.106.12.https: Flags [.], ack 2504, win 501, options [nop,nop,TS val 611256602 ecr 2442180478], length 0
09:57:23.859528 IP 104.248.106.12.8132 > 165.22.226.164.38068: Flags [P.], seq 1259:1337, ack 2700, win 2577, options [nop,nop,TS val 3057402226 ecr 253366607], length 78
09:57:23.859657 IP 165.22.226.164.38068 > 104.248.106.12.8132: Flags [.], ack 1337, win 501, options [nop,nop,TS val 253371121 ecr 3057402226], length 0
09:57:23.860761 IP 165.22.226.164.38068 > 104.248.106.12.8132: Flags [P.], seq 2700:2752, ack 1337, win 501, options [nop,nop,TS val 253371123 ecr 3057402226], length 52
09:57:23.860932 IP 165.22.226.164.38068 > 104.248.106.12.8132: Flags [P.], seq 2752:2830, ack 1337, win 501, options [nop,nop,TS val 253371123 ecr 3057402226], length 78
09:57:23.861399 IP 104.248.106.12.8132 > 165.22.226.164.38068: Flags [.], ack 2752, win 2577, options [nop,nop,TS val 3057402228 ecr 253371123], length 0
09:57:23.861435 IP 104.248.106.12.8132 > 165.22.226.164.38068: Flags [.], ack 2830, win 2577, options [nop,nop,TS val 3057402228 ecr 253371123], length 0
09:57:23.862937 IP 104.248.106.12.8132 > 165.22.226.164.38068: Flags [P.], seq 1337:1406, ack 2830, win 2577, options [nop,nop,TS val 3057402230 ecr 253371123], length 69
09:57:23.862974 IP 165.22.226.164.38068 > 104.248.106.12.8132: Flags [.], ack 1406, win 501, options [nop,nop,TS val 253371125 ecr 3057402230], length 0
09:57:23.863069 IP 165.22.226.164.38068 > 104.248.106.12.8132: Flags [P.], seq 2830:2869, ack 1406, win 501, options [nop,nop,TS val 253371125 ecr 3057402230], length 39
09:57:23.905325 IP 104.248.106.12.8132 > 165.22.226.164.38068: Flags [.], ack 2869, win 2577, options [nop,nop,TS val 3057402272 ecr 253371125], length 0
09:57:24.924385 IP 104.248.106.12.https > 165.22.226.164.32990: Flags [P.], seq 8614:8717, ack 656, win 6513, options [nop,nop,TS val 2442181718 ecr 611250914], length 103
09:57:24.924438 IP 165.22.226.164.32990 > 104.248.106.12.https: Flags [.], ack 8717, win 10412, options [nop,nop,TS val 611257842 ecr 2442181718], length 0
09:57:25.016725 IP 104.248.106.12.https > 165.22.226.164.32990: Flags [P.], seq 8717:8860, ack 656, win 6513, options [nop,nop,TS val 2442181810 ecr 611257842], length 143
09:57:25.016726 IP 104.248.106.12.https > 165.22.226.164.49554: Flags [P.], seq 286:429, ack 1, win 501, options [nop,nop,TS val 2442181810 ecr 611249137], length 143
09:57:25.016772 IP 165.22.226.164.32990 > 104.248.106.12.https: Flags [.], ack 8860, win 10412, options [nop,nop,TS val 611257935 ecr 2442181810], length 0
09:57:25.016794 IP 165.22.226.164.49554 > 104.248.106.12.https: Flags [.], ack 429, win 9013, options [nop,nop,TS val 611257935 ecr 2442181810], length 0
09:57:25.285790 IP 165.22.226.164.33010 > 104.248.106.12.https: Flags [P.], seq 3711:3750, ack 7667, win 501, options [nop,nop,TS val 611258204 ecr 3723209473], length 39
09:57:25.292698 IP 104.248.106.12.https > 165.22.226.164.33010: Flags [P.], seq 7667:8210, ack 3750, win 6163, options [nop,nop,TS val 3723211485 ecr 611258204], length 543
09:57:25.293259 IP 165.22.226.164.33010 > 104.248.106.12.https: Flags [P.], seq 3750:3791, ack 8210, win 501, options [nop,nop,TS val 611258211 ecr 3723211485], length 41
