09:04:50.880579 IP localhost.42007 > localhost.43096: Flags [P.], seq 4201929448:4201929452, ack 1247195164, win 512, options [nop,nop,TS val 2025858775 ecr 2025858770], length 4
09:04:50.880599 IP localhost.43096 > localhost.42007: Flags [.], ack 4, win 512, options [nop,nop,TS val 2025858775 ecr 2025858775], length 0
09:04:50.880626 IP localhost.42007 > localhost.43096: Flags [P.], seq 4:8, ack 1, win 512, options [nop,nop,TS val 2025858776 ecr 2025858775], length 4
09:04:50.880638 IP localhost.43096 > localhost.42007: Flags [.], ack 8, win 512, options [nop,nop,TS val 2025858776 ecr 2025858776], length 0
09:04:50.880645 IP localhost.42007 > localhost.43096: Flags [P.], seq 8:84, ack 1, win 512, options [nop,nop,TS val 2025858776 ecr 2025858776], length 76
09:04:50.880648 IP localhost.43096 > localhost.42007: Flags [.], ack 84, win 512, options [nop,nop,TS val 2025858776 ecr 2025858776], length 0
09:04:50.880776 IP 10.118.0.2.10250 > 10.118.0.6.41356: Flags [P.], seq 46471180:46471286, ack 2768229980, win 501, options [nop,nop,TS val 29990573 ecr 3460320325], length 106
09:04:50.880947 IP localhost.42007 > localhost.43096: Flags [P.], seq 84:88, ack 1, win 512, options [nop,nop,TS val 2025858776 ecr 2025858776], length 4
09:04:50.880963 IP localhost.42007 > localhost.43096: Flags [P.], seq 88:92, ack 1, win 512, options [nop,nop,TS val 2025858776 ecr 2025858776], length 4
09:04:50.880982 IP localhost.42007 > localhost.43096: Flags [P.], seq 92:94, ack 1, win 512, options [nop,nop,TS val 2025858776 ecr 2025858776], length 2
09:04:50.881026 IP localhost.43096 > localhost.42007: Flags [.], ack 94, win 512, options [nop,nop,TS val 2025858776 ecr 2025858776], length 0
09:04:50.881044 IP 10.118.0.2.10250 > 10.118.0.6.41356: Flags [P.], seq 106:138, ack 1, win 501, options [nop,nop,TS val 29990573 ecr 3460320325], length 32
09:04:50.881334 IP localhost.42007 > localhost.43096: Flags [P.], seq 94:98, ack 1, win 512, options [nop,nop,TS val 2025858776 ecr 2025858776], length 4
09:04:50.881363 IP localhost.42007 > localhost.43096: Flags [P.], seq 98:102, ack 1, win 512, options [nop,nop,TS val 2025858776 ecr 2025858776], length 4
09:04:50.881370 IP localhost.42007 > localhost.43096: Flags [P.], seq 102:181, ack 1, win 512, options [nop,nop,TS val 2025858776 ecr 2025858776], length 79
09:04:50.881395 IP localhost.43096 > localhost.42007: Flags [.], ack 181, win 512, options [nop,nop,TS val 2025858776 ecr 2025858776], length 0
09:04:50.881408 IP 10.118.0.2.10250 > 10.118.0.6.41356: Flags [P.], seq 138:247, ack 1, win 501, options [nop,nop,TS val 29990573 ecr 3460320325], length 109
09:04:50.881530 IP localhost.42007 > localhost.43096: Flags [P.], seq 181:185, ack 1, win 512, options [nop,nop,TS val 2025858776 ecr 2025858776], length 4
09:04:50.881542 IP localhost.42007 > localhost.43096: Flags [P.], seq 185:189, ack 1, win 512, options [nop,nop,TS val 2025858776 ecr 2025858776], length 4
09:04:50.881547 IP localhost.42007 > localhost.43096: Flags [P.], seq 189:191, ack 1, win 512, options [nop,nop,TS val 2025858776 ecr 2025858776], length 2
09:04:50.881568 IP localhost.43096 > localhost.42007: Flags [.], ack 191, win 512, options [nop,nop,TS val 2025858776 ecr 2025858776], length 0
09:04:50.881609 IP 10.118.0.2.10250 > 10.118.0.6.41356: Flags [P.], seq 247:279, ack 1, win 501, options [nop,nop,TS val 29990573 ecr 3460320325], length 32
09:04:50.881855 IP 10.118.0.6.41356 > 10.118.0.2.10250: Flags [.], ack 106, win 4514, options [nop,nop,TS val 3460320332 ecr 29990573], length 0
09:04:50.881855 IP 10.118.0.6.41356 > 10.118.0.2.10250: Flags [.], ack 138, win 4514, options [nop,nop,TS val 3460320332 ecr 29990573], length 0
09:04:50.882130 IP 10.118.0.6.41356 > 10.118.0.2.10250: Flags [.], ack 247, win 4514, options [nop,nop,TS val 3460320333 ecr 29990573], length 0
09:04:50.882410 IP 10.118.0.6.41356 > 10.118.0.2.10250: Flags [.], ack 279, win 4514, options [nop,nop,TS val 3460320333 ecr 29990573], length 0
09:04:50.898060 IP 165.22.226.164.34024 > 104.248.106.12.https: Flags [P.], seq 2123029586:2123029625, ack 74293747, win 1174, options [nop,nop,TS val 608103816 ecr 3720027100], length 39
09:04:50.905672 IP 104.248.106.12.https > 165.22.226.164.34024: Flags [P.], seq 1:13121, ack 39, win 501, options [nop,nop,TS val 3720057097 ecr 608103816], length 13120
09:04:50.905733 IP 165.22.226.164.34024 > 104.248.106.12.https: Flags [.], ack 13121, win 1132, options [nop,nop,TS val 608103824 ecr 3720057097], length 0
09:04:50.905860 IP 104.248.106.12.https > 165.22.226.164.34024: Flags [P.], seq 13121:17465, ack 39, win 501, options [nop,nop,TS val 3720057097 ecr 608103816], length 4344
09:04:50.905872 IP 165.22.226.164.34024 > 104.248.106.12.https: Flags [.], ack 17465, win 1166, options [nop,nop,TS val 608103824 ecr 3720057097], length 0
09:04:50.905934 IP 165.22.226.164.34024 > 104.248.106.12.https: Flags [P.], seq 39:74, ack 17465, win 1174, options [nop,nop,TS val 608103824 ecr 3720057097], length 35
09:04:50.905945 IP 104.248.106.12.https > 165.22.226.164.34024: Flags [P.], seq 17465:26473, ack 39, win 501, options [nop,nop,TS val 3720057097 ecr 608103816], length 9008
09:04:50.905980 IP 165.22.226.164.34024 > 104.248.106.12.https: Flags [.], ack 26473, win 1174, options [nop,nop,TS val 608103824 ecr 3720057097], length 0
09:04:50.905994 IP 165.22.226.164.34024 > 104.248.106.12.https: Flags [P.], seq 74:109, ack 26473, win 1174, options [nop,nop,TS val 608103824 ecr 3720057097], length 35
09:04:50.906022 IP 165.22.226.164.34024 > 104.248.106.12.https: Flags [P.], seq 109:179, ack 26473, win 1174, options [nop,nop,TS val 608103824 ecr 3720057097], length 70
09:04:50.906340 IP 104.248.106.12.https > 165.22.226.164.34024: Flags [.], ack 109, win 501, options [nop,nop,TS val 3720057098 ecr 608103824], length 0
09:04:50.947352 IP 104.248.106.12.https > 165.22.226.164.34024: Flags [.], ack 179, win 501, options [nop,nop,TS val 3720057139 ecr 608103824], length 0
09:04:51.660124 IP 165.22.226.164.33010 > 104.248.106.12.https: Flags [P.], seq 301496000:301496039, ack 2500865823, win 501, options [nop,nop,TS val 608104578 ecr 3720055845], length 39
09:04:51.664625 IP 104.248.106.12.https > 165.22.226.164.33010: Flags [P.], seq 1:544, ack 39, win 6146, options [nop,nop,TS val 3720057856 ecr 608104578], length 543
09:04:51.665178 IP 165.22.226.164.33010 > 104.248.106.12.https: Flags [P.], seq 39:80, ack 544, win 501, options [nop,nop,TS val 608104583 ecr 3720057856], length 41
09:04:51.665222 IP 165.22.226.164.33010 > 104.248.106.12.https: Flags [P.], seq 80:531, ack 544, win 501, options [nop,nop,TS val 608104583 ecr 3720057856], length 451
09:04:51.665724 IP 104.248.106.12.https > 165.22.226.164.33010: Flags [.], ack 531, win 6146, options [nop,nop,TS val 3720057857 ecr 608104583], length 0
09:04:51.667324 IP 104.248.106.12.https > 165.22.226.164.33010: Flags [P.], seq 544:579, ack 531, win 6146, options [nop,nop,TS val 3720057859 ecr 608104583], length 35
09:04:51.670799 IP 104.248.106.12.https > 165.22.226.164.33010: Flags [P.], seq 579:1099, ack 531, win 6146, options [nop,nop,TS val 3720057862 ecr 608104583], length 520
09:04:51.670957 IP 165.22.226.164.33010 > 104.248.106.12.https: Flags [.], ack 1099, win 501, options [nop,nop,TS val 608104589 ecr 3720057859], length 0
09:04:51.675237 IP 10.244.0.11.37620 > 10.244.0.76.8181: Flags [S], seq 1835768522, win 64240, options [mss 1460,sackOK,TS val 924967620 ecr 0,nop,wscale 7], length 0
09:04:51.675262 IP 10.244.0.76.8181 > 10.244.0.11.37620: Flags [S.], seq 962652677, ack 1835768523, win 65160, options [mss 1460,sackOK,TS val 2521663100 ecr 924967620,nop,wscale 7], length 0
09:04:51.675288 IP 10.244.0.11.37620 > 10.244.0.76.8181: Flags [.], ack 1, win 502, options [nop,nop,TS val 924967620 ecr 2521663100], length 0
09:04:51.675414 IP 10.244.0.11.37620 > 10.244.0.76.8181: Flags [P.], seq 1:109, ack 1, win 502, options [nop,nop,TS val 924967620 ecr 2521663100], length 108
09:04:51.675418 IP 10.244.0.76.8181 > 10.244.0.11.37620: Flags [.], ack 109, win 509, options [nop,nop,TS val 2521663100 ecr 924967620], length 0
09:04:51.675654 IP 10.244.0.76.8181 > 10.244.0.11.37620: Flags [P.], seq 1:138, ack 109, win 509, options [nop,nop,TS val 2521663101 ecr 924967620], length 137
09:04:51.675676 IP 10.244.0.11.37620 > 10.244.0.76.8181: Flags [.], ack 138, win 501, options [nop,nop,TS val 924967621 ecr 2521663101], length 0
09:04:51.675710 IP 10.244.0.76.8181 > 10.244.0.11.37620: Flags [F.], seq 138, ack 109, win 509, options [nop,nop,TS val 2521663101 ecr 924967621], length 0
09:04:51.675789 IP 10.244.0.11.37620 > 10.244.0.76.8181: Flags [F.], seq 109, ack 139, win 501, options [nop,nop,TS val 924967621 ecr 2521663101], length 0
09:04:51.675794 IP 10.244.0.76.8181 > 10.244.0.11.37620: Flags [.], ack 110, win 509, options [nop,nop,TS val 2521663101 ecr 924967621], length 0
09:04:51.792497 IP 10.118.0.4.49030 > 10.118.0.2.31145: Flags [S], seq 1294192067, win 64240, options [mss 1460,sackOK,TS val 2091136050 ecr 0,nop,wscale 7], length 0
09:04:51.792556 IP 10.118.0.2.56130 > 10.244.1.22.http: Flags [S], seq 1294192067, win 64240, options [mss 1460,sackOK,TS val 2091136050 ecr 0,nop,wscale 7], length 0
09:04:51.793493 IP 10.244.1.22.http > 10.118.0.2.56130: Flags [S.], seq 3473922040, ack 1294192068, win 65160, options [mss 1460,sackOK,TS val 515975974 ecr 2091136050,nop,wscale 7], length 0
09:04:51.793523 ARP, Request who-has 10.118.0.4 tell 10.118.0.2, length 28
09:04:51.795355 ARP, Reply 10.118.0.4 is-at da:97:c9:65:39:62 (oui Unknown), length 28
09:04:51.795364 IP 10.118.0.2.31145 > 10.118.0.4.49030: Flags [S.], seq 3473922040, ack 1294192068, win 65160, options [mss 1460,sackOK,TS val 515975974 ecr 2091136050,nop,wscale 7], length 0
09:04:51.796236 IP 10.118.0.4.49030 > 10.118.0.2.31145: Flags [.], ack 1, win 502, options [nop,nop,TS val 2091136054 ecr 515975974], length 0
09:04:51.796262 IP 10.118.0.2.56130 > 10.244.1.22.http: Flags [.], ack 1, win 502, options [nop,nop,TS val 2091136054 ecr 515975974], length 0
09:04:51.796344 IP 10.118.0.4.49030 > 10.118.0.2.31145: Flags [F.], seq 1, ack 1, win 502, options [nop,nop,TS val 2091136054 ecr 515975974], length 0
09:04:51.796348 IP 10.118.0.2.56130 > 10.244.1.22.http: Flags [F.], seq 1, ack 1, win 502, options [nop,nop,TS val 2091136054 ecr 515975974], length 0
09:04:51.797257 IP 10.244.1.22.http > 10.118.0.2.56130: Flags [F.], seq 1, ack 2, win 510, options [nop,nop,TS val 515975977 ecr 2091136054], length 0
09:04:51.797284 IP 10.118.0.2.31145 > 10.118.0.4.49030: Flags [F.], seq 1, ack 2, win 510, options [nop,nop,TS val 515975977 ecr 2091136054], length 0
09:04:51.797761 IP 10.118.0.4.49030 > 10.118.0.2.31145: Flags [.], ack 2, win 502, options [nop,nop,TS val 2091136055 ecr 515975977], length 0
09:04:51.797788 IP 10.118.0.2.56130 > 10.244.1.22.http: Flags [.], ack 2, win 502, options [nop,nop,TS val 2091136055 ecr 515975977], length 0
09:04:51.801142 IP 10.244.0.26.49246 > 10.118.0.6.10250: Flags [P.], seq 4238460955:4238460993, ack 4223724744, win 501, options [nop,nop,TS val 4289678759 ecr 960499357], length 38
09:04:51.801191 IP 10.118.0.2.49246 > 10.118.0.6.10250: Flags [P.], seq 4238460955:4238460993, ack 4223724744, win 501, options [nop,nop,TS val 4289678759 ecr 960499357], length 38
09:04:51.803528 IP 10.244.0.26.51936 > 10.118.0.5.10250: Flags [P.], seq 639523406:639523444, ack 1055978258, win 501, options [nop,nop,TS val 435317567 ecr 2343380005], length 38
09:04:51.803570 IP 10.118.0.2.51936 > 10.118.0.5.10250: Flags [P.], seq 639523406:639523444, ack 1055978258, win 501, options [nop,nop,TS val 435317567 ecr 2343380005], length 38
09:04:51.815977 IP 10.244.0.26.38042 > 10.118.0.2.10250: Flags [P.], seq 3788280796:3788280834, ack 3302845475, win 501, options [nop,nop,TS val 354636925 ecr 2365280423], length 38
09:04:51.816047 IP 10.118.0.2.10250 > 10.244.0.26.38042: Flags [.], ack 38, win 501, options [nop,nop,TS val 2365295384 ecr 354636925], length 0
09:04:51.816658 IP 165.22.226.164.32990 > 104.248.106.12.https: Flags [P.], seq 4243072935:4243072975, ack 745796901, win 10412, options [nop,nop,TS val 608104735 ecr 2439027577], length 40
09:04:51.816687 IP 165.22.226.164.32990 > 104.248.106.12.https: Flags [P.], seq 40:1182, ack 1, win 10412, options [nop,nop,TS val 608104735 ecr 2439027577], length 1142
09:04:51.817145 IP 104.248.106.12.https > 165.22.226.164.32990: Flags [.], ack 1182, win 4019, options [nop,nop,TS val 2439028610 ecr 608104735], length 0
09:04:51.820282 IP 10.118.0.6.10250 > 10.118.0.2.49246: Flags [P.], seq 1:60, ack 38, win 501, options [nop,nop,TS val 960514353 ecr 4289678759], length 59
09:04:51.820326 IP 10.118.0.6.10250 > 10.244.0.26.49246: Flags [P.], seq 1:60, ack 38, win 501, options [nop,nop,TS val 960514353 ecr 4289678759], length 59
09:04:51.820342 IP 10.244.0.26.49246 > 10.118.0.6.10250: Flags [.], ack 60, win 501, options [nop,nop,TS val 4289678778 ecr 960514353], length 0
09:04:51.820366 IP 10.118.0.2.49246 > 10.118.0.6.10250: Flags [.], ack 60, win 501, options [nop,nop,TS val 4289678778 ecr 960514353], length 0
09:04:51.820474 IP 10.118.0.6.10250 > 10.118.0.2.49246: Flags [P.], seq 60:1302, ack 38, win 501, options [nop,nop,TS val 960514353 ecr 4289678759], length 1242
09:04:51.820482 IP 10.118.0.6.10250 > 10.244.0.26.49246: Flags [P.], seq 60:1302, ack 38, win 501, options [nop,nop,TS val 960514353 ecr 4289678759], length 1242
09:04:51.820485 IP 10.244.0.26.49246 > 10.118.0.6.10250: Flags [.], ack 1302, win 524, options [nop,nop,TS val 4289678778 ecr 960514353], length 0
09:04:51.820491 IP 10.118.0.2.49246 > 10.118.0.6.10250: Flags [.], ack 1302, win 524, options [nop,nop,TS val 4289678778 ecr 960514353], length 0
09:04:51.823719 IP 10.118.0.5.10250 > 10.118.0.2.51936: Flags [P.], seq 1:60, ack 38, win 501, options [nop,nop,TS val 2343395001 ecr 435317567], length 59
09:04:51.823719 IP 10.118.0.5.10250 > 10.118.0.2.51936: Flags [P.], seq 60:1302, ack 38, win 501, options [nop,nop,TS val 2343395001 ecr 435317567], length 1242
09:04:51.823771 IP 10.118.0.5.10250 > 10.244.0.26.51936: Flags [P.], seq 1:60, ack 38, win 501, options [nop,nop,TS val 2343395001 ecr 435317567], length 59
09:04:51.823776 IP 10.118.0.5.10250 > 10.244.0.26.51936: Flags [P.], seq 60:1302, ack 38, win 501, options [nop,nop,TS val 2343395001 ecr 435317567], length 1242
09:04:51.823794 IP 10.244.0.26.51936 > 10.118.0.5.10250: Flags [.], ack 60, win 501, options [nop,nop,TS val 435317588 ecr 2343395001], length 0
09:04:51.823822 IP 10.118.0.2.51936 > 10.118.0.5.10250: Flags [.], ack 60, win 501, options [nop,nop,TS val 435317588 ecr 2343395001], length 0
09:04:51.823806 IP 10.244.0.26.51936 > 10.118.0.5.10250: Flags [.], ack 1302, win 501, options [nop,nop,TS val 435317588 ecr 2343395001], length 0
09:04:51.823840 IP 10.118.0.2.51936 > 10.118.0.5.10250: Flags [.], ack 1302, win 501, options [nop,nop,TS val 435317588 ecr 2343395001], length 0
09:04:51.826235 IP 104.248.106.12.https > 165.22.226.164.32990: Flags [P.], seq 1:84, ack 1182, win 4019, options [nop,nop,TS val 2439028619 ecr 608104735], length 83
09:04:51.826272 IP 165.22.226.164.32990 > 104.248.106.12.https: Flags [.], ack 84, win 10412, options [nop,nop,TS val 608104744 ecr 2439028619], length 0
09:04:51.826414 IP 104.248.106.12.https > 165.22.226.164.32990: Flags [P.], seq 84:237, ack 1182, win 4019, options [nop,nop,TS val 2439028619 ecr 608104735], length 153
09:04:51.826429 IP 165.22.226.164.32990 > 104.248.106.12.https: Flags [.], ack 237, win 10412, options [nop,nop,TS val 608104744 ecr 2439028619], length 0
09:04:51.826519 IP 104.248.106.12.https > 165.22.226.164.32990: Flags [P.], seq 237:1820, ack 1182, win 4019, options [nop,nop,TS val 2439028619 ecr 608104735], length 1583
09:04:51.826528 IP 165.22.226.164.32990 > 104.248.106.12.https: Flags [.], ack 1820, win 10406, options [nop,nop,TS val 608104744 ecr 2439028619], length 0
09:04:51.846189 IP 10.118.0.2.10250 > 10.244.0.26.38042: Flags [P.], seq 1:60, ack 38, win 501, options [nop,nop,TS val 2365295414 ecr 354636925], length 59
09:04:51.846206 IP 10.244.0.26.38042 > 10.118.0.2.10250: Flags [.], ack 60, win 501, options [nop,nop,TS val 354636955 ecr 2365295414], length 0
09:04:51.846481 IP 10.118.0.2.10250 > 10.244.0.26.38042: Flags [P.], seq 60:1858, ack 38, win 501, options [nop,nop,TS val 2365295414 ecr 354636955], length 1798
09:04:51.846486 IP 10.244.0.26.38042 > 10.118.0.2.10250: Flags [.], ack 1858, win 500, options [nop,nop,TS val 354636955 ecr 2365295414], length 0
09:04:51.902299 IP 165.22.226.164.49744 > 67.207.67.3.domain: 31938+ PTR? 6.0.118.10.in-addr.arpa. (41)
09:04:51.904289 IP 67.207.67.3.domain > 165.22.226.164.49744: 31938 NXDomain 0/1/0 (90)
09:04:51.904488 IP 165.22.226.164.38771 > 67.207.67.3.domain: 9+ PTR? 2.0.118.10.in-addr.arpa. (41)
09:04:51.905207 IP 67.207.67.3.domain > 165.22.226.164.38771: 9 NXDomain 0/1/0 (90)
09:04:51.905410 IP 165.22.226.164.42444 > 67.207.67.3.domain: 36021+ PTR? 12.106.248.104.in-addr.arpa. (45)
09:04:51.941922 IP 67.207.67.3.domain > 165.22.226.164.42444: 36021 NXDomain 0/1/0 (112)
09:04:51.942164 IP 165.22.226.164.60681 > 67.207.67.3.domain: 51716+ PTR? 164.226.22.165.in-addr.arpa. (45)
09:04:52.024555 IP 67.207.67.3.domain > 165.22.226.164.60681: 51716 NXDomain 0/1/0 (112)
09:04:52.024993 IP 165.22.226.164.55626 > 67.207.67.3.domain: 44654+ PTR? 76.0.244.10.in-addr.arpa. (42)
09:04:52.026296 IP 67.207.67.3.domain > 165.22.226.164.55626: 44654 NXDomain 0/1/0 (91)
09:04:52.026469 IP 165.22.226.164.37371 > 67.207.67.3.domain: 53403+ PTR? 11.0.244.10.in-addr.arpa. (42)
09:04:52.027751 IP 67.207.67.3.domain > 165.22.226.164.37371: 53403 NXDomain 0/1/0 (91)
09:04:52.027992 IP 165.22.226.164.32954 > 67.207.67.3.domain: 50350+ PTR? 4.0.118.10.in-addr.arpa. (41)
09:04:52.028526 IP 67.207.67.3.domain > 165.22.226.164.32954: 50350 NXDomain 0/1/0 (90)
09:04:52.028661 IP 165.22.226.164.54069 > 67.207.67.3.domain: 19019+ PTR? 22.1.244.10.in-addr.arpa. (42)
09:04:52.029354 IP 67.207.67.3.domain > 165.22.226.164.54069: 19019 NXDomain 0/1/0 (91)
09:04:52.029528 IP 165.22.226.164.54609 > 67.207.67.3.domain: 53397+ PTR? 26.0.244.10.in-addr.arpa. (42)
09:04:52.030035 IP 67.207.67.3.domain > 165.22.226.164.54609: 53397 NXDomain 0/1/0 (91)
09:04:52.030162 IP 165.22.226.164.39066 > 67.207.67.3.domain: 17058+ PTR? 5.0.118.10.in-addr.arpa. (41)
09:04:52.030647 IP 67.207.67.3.domain > 165.22.226.164.39066: 17058 NXDomain 0/1/0 (90)
09:04:52.153240 IP 10.244.0.11.50726 > 10.244.0.103.http-alt: Flags [S], seq 1914128452, win 64240, options [mss 1460,sackOK,TS val 1595395992 ecr 0,nop,wscale 7], length 0
09:04:52.153267 IP 10.244.0.103.http-alt > 10.244.0.11.50726: Flags [S.], seq 3030205128, ack 1914128453, win 65160, options [mss 1460,sackOK,TS val 401615076 ecr 1595395992,nop,wscale 7], length 0
09:04:52.153308 IP 10.244.0.11.50726 > 10.244.0.103.http-alt: Flags [.], ack 1, win 502, options [nop,nop,TS val 1595395992 ecr 401615076], length 0
09:04:52.153867 IP 10.244.0.11.50726 > 10.244.0.103.http-alt: Flags [P.], seq 1:111, ack 1, win 502, options [nop,nop,TS val 1595395993 ecr 401615076], length 110: HTTP: GET /health HTTP/1.1
09:04:52.153881 IP 10.244.0.103.http-alt > 10.244.0.11.50726: Flags [.], ack 111, win 509, options [nop,nop,TS val 401615077 ecr 1595395993], length 0
09:04:52.154003 IP 10.244.0.103.http-alt > 10.244.0.11.50726: Flags [P.], seq 1:138, ack 111, win 509, options [nop,nop,TS val 401615077 ecr 1595395993], length 137: HTTP: HTTP/1.1 200 OK
09:04:52.154037 IP 10.244.0.103.http-alt > 10.244.0.11.50726: Flags [F.], seq 138, ack 111, win 509, options [nop,nop,TS val 401615077 ecr 1595395993], length 0
09:04:52.154068 IP 10.244.0.11.50726 > 10.244.0.103.http-alt: Flags [.], ack 138, win 501, options [nop,nop,TS val 1595395993 ecr 401615077], length 0
09:04:52.154132 IP 10.244.0.11.50726 > 10.244.0.103.http-alt: Flags [F.], seq 111, ack 139, win 501, options [nop,nop,TS val 1595395993 ecr 401615077], length 0
09:04:52.154138 IP 10.244.0.103.http-alt > 10.244.0.11.50726: Flags [.], ack 112, win 509, options [nop,nop,TS val 401615077 ecr 1595395993], length 0
09:04:52.219813 IP 165.22.226.164.64059 > 10.244.0.76.domain: 15469+ A? kube-state-metrics.kube-system.svc.cluster.local.kube-system.svc.cluster.local. (96)
09:04:52.219845 IP 165.22.226.164.64059 > 10.244.0.76.domain: 22649+ AAAA? kube-state-metrics.kube-system.svc.cluster.local.kube-system.svc.cluster.local. (96)
09:04:52.220096 IP 10.244.0.76.domain > 165.22.226.164.64059: 22649 NXDomain*- 0/1/0 (189)
09:04:52.220327 IP 10.244.0.76.domain > 165.22.226.164.64059: 15469 NXDomain*- 0/1/0 (189)
09:04:52.220645 IP 165.22.226.164.19035 > 10.244.0.76.domain: 23047+ A? kube-state-metrics.kube-system.svc.cluster.local.svc.cluster.local. (84)
09:04:52.220663 IP 165.22.226.164.19035 > 10.244.0.76.domain: 54285+ AAAA? kube-state-metrics.kube-system.svc.cluster.local.svc.cluster.local. (84)
09:04:52.220809 IP 10.244.0.76.domain > 165.22.226.164.19035: 54285 NXDomain*- 0/1/0 (177)
09:04:52.220898 IP 10.244.0.76.domain > 165.22.226.164.19035: 23047 NXDomain*- 0/1/0 (177)
09:04:52.220975 IP 165.22.226.164.7013 > 10.244.0.103.domain: 41068+ A? kube-state-metrics.kube-system.svc.cluster.local.cluster.local. (80)
09:04:52.220990 IP 165.22.226.164.7013 > 10.244.0.103.domain: 36977+ AAAA? kube-state-metrics.kube-system.svc.cluster.local.cluster.local. (80)
09:04:52.221155 IP 10.244.0.103.domain > 165.22.226.164.7013: 36977 NXDomain*- 0/1/0 (173)
09:04:52.221233 IP 10.244.0.103.domain > 165.22.226.164.7013: 41068 NXDomain*- 0/1/0 (173)
09:04:52.221299 IP 165.22.226.164.44351 > 10.244.0.76.domain: 65271+ A? kube-state-metrics.kube-system.svc.cluster.local. (66)
09:04:52.221309 IP 165.22.226.164.44351 > 10.244.0.76.domain: 36604+ AAAA? kube-state-metrics.kube-system.svc.cluster.local. (66)
09:04:52.221438 IP 10.244.0.76.domain > 165.22.226.164.44351: 36604 NXDomain*- 0/1/0 (159)
09:04:52.221553 IP 10.244.0.76.domain > 165.22.226.164.44351: 65271 NXDomain*- 0/1/0 (159)
09:04:52.307437 IP 10.244.1.112.51660 > 10.244.0.26.10250: Flags [P.], seq 2560547755:2560547871, ack 725041522, win 501, options [nop,nop,TS val 3770590306 ecr 46466504], length 116
09:04:52.307496 IP 10.244.1.112.51660 > 10.244.0.26.10250: Flags [P.], seq 0:116, ack 1, win 501, options [nop,nop,TS val 3770590306 ecr 46466504], length 116
09:04:52.314385 IP 10.244.0.26.10250 > 10.244.1.112.51660: Flags [P.], seq 1:89, ack 116, win 501, options [nop,nop,TS val 46468747 ecr 3770590306], length 88
09:04:52.314497 IP 10.244.0.26.10250 > 10.244.1.112.51660: Flags [P.], seq 1:89, ack 116, win 501, options [nop,nop,TS val 46468747 ecr 3770590306], length 88
09:04:52.314571 IP 10.244.0.26.10250 > 10.244.1.112.51660: Flags [P.], seq 89:756, ack 116, win 501, options [nop,nop,TS val 46468747 ecr 3770590306], length 667
09:04:52.314580 IP 10.244.0.26.10250 > 10.244.1.112.51660: Flags [P.], seq 89:756, ack 116, win 501, options [nop,nop,TS val 46468747 ecr 3770590306], length 667
09:04:52.315463 IP 10.244.1.112.51660 > 10.244.0.26.10250: Flags [.], ack 89, win 501, options [nop,nop,TS val 3770590314 ecr 46468747], length 0
09:04:52.315463 IP 10.244.1.112.51660 > 10.244.0.26.10250: Flags [.], ack 756, win 497, options [nop,nop,TS val 3770590314 ecr 46468747], length 0
09:04:52.315501 IP 10.244.1.112.51660 > 10.244.0.26.10250: Flags [.], ack 89, win 501, options [nop,nop,TS val 3770590314 ecr 46468747], length 0
09:04:52.315505 IP 10.244.1.112.51660 > 10.244.0.26.10250: Flags [.], ack 756, win 497, options [nop,nop,TS val 3770590314 ecr 46468747], length 0
09:04:52.412632 IP 165.22.226.164.38910 > 169.254.169.254.http: Flags [S], seq 3739197838, win 64240, options [mss 1460,sackOK,TS val 3245803357 ecr 0,nop,wscale 7], length 0
09:04:52.414061 IP 169.254.169.254.http > 165.22.226.164.38910: Flags [S.], seq 436811052, ack 3739197839, win 65016, options [mss 1560,sackOK,TS val 617545460 ecr 3245803357,nop,wscale 7], length 0
09:04:52.414127 IP 165.22.226.164.38910 > 169.254.169.254.http: Flags [.], ack 1, win 502, options [nop,nop,TS val 3245803359 ecr 617545460], length 0
09:04:52.414383 IP 165.22.226.164.38910 > 169.254.169.254.http: Flags [P.], seq 1:1401, ack 1, win 502, options [nop,nop,TS val 3245803359 ecr 617545460], length 1400: HTTP: POST /v1/metrics/droplet_id/329592474 HTTP/1.1
09:04:52.414698 IP 169.254.169.254.http > 165.22.226.164.38910: Flags [.], ack 1401, win 500, options [nop,nop,TS val 617545461 ecr 3245803359], length 0
09:04:52.434135 IP 169.254.169.254.http > 165.22.226.164.38910: Flags [P.], seq 1:228, ack 1401, win 500, options [nop,nop,TS val 617545481 ecr 3245803359], length 227: HTTP: HTTP/1.1 202 Accepted
09:04:52.434135 IP 169.254.169.254.http > 165.22.226.164.38910: Flags [F.], seq 228, ack 1401, win 500, options [nop,nop,TS val 617545481 ecr 3245803359], length 0
09:04:52.434254 IP 165.22.226.164.38910 > 169.254.169.254.http: Flags [.], ack 228, win 501, options [nop,nop,TS val 3245803379 ecr 617545481], length 0
09:04:52.434604 IP 165.22.226.164.38910 > 169.254.169.254.http: Flags [F.], seq 1401, ack 229, win 501, options [nop,nop,TS val 3245803379 ecr 617545481], length 0
09:04:52.434735 IP 169.254.169.254.http > 165.22.226.164.38910: Flags [.], ack 1402, win 500, options [nop,nop,TS val 617545481 ecr 3245803379], length 0
09:04:52.925678 IP 165.22.226.164.34218 > 67.207.67.3.domain: 1711+ PTR? 3.67.207.67.in-addr.arpa. (42)
09:04:52.926261 IP 67.207.67.3.domain > 165.22.226.164.34218: 1711 NXDomain 0/1/0 (109)
09:04:52.926509 IP 165.22.226.164.48303 > 67.207.67.3.domain: 65233+ PTR? 103.0.244.10.in-addr.arpa. (43)
09:04:52.927682 IP 67.207.67.3.domain > 165.22.226.164.48303: 65233 NXDomain 0/1/0 (92)
09:04:52.928015 IP 165.22.226.164.44198 > 67.207.67.3.domain: 12010+ PTR? 112.1.244.10.in-addr.arpa. (43)
09:04:52.928616 IP 67.207.67.3.domain > 165.22.226.164.44198: 12010 NXDomain 0/1/0 (92)
09:04:52.928800 IP 165.22.226.164.38203 > 67.207.67.3.domain: 60042+ PTR? 254.169.254.169.in-addr.arpa. (46)
09:04:52.929381 IP 67.207.67.3.domain > 165.22.226.164.38203: 60042 NXDomain 0/1/0 (123)
09:04:53.125724 IP 165.22.226.164.34034 > 104.248.106.12.https: Flags [P.], seq 3850770225:3850770264, ack 1492159223, win 501, options [nop,nop,TS val 608106044 ecr 2635130439], length 39
09:04:53.128410 IP 104.248.106.12.https > 165.22.226.164.34034: Flags [P.], seq 1:40, ack 39, win 501, options [nop,nop,TS val 2635160443 ecr 608106044], length 39
09:04:53.128468 IP 165.22.226.164.34034 > 104.248.106.12.https: Flags [.], ack 40, win 501, options [nop,nop,TS val 608106046 ecr 2635160443], length 0
09:04:53.671574 IP 165.22.226.164.33010 > 104.248.106.12.https: Flags [P.], seq 531:570, ack 1099, win 501, options [nop,nop,TS val 608106589 ecr 3720057859], length 39
09:04:53.676381 IP 104.248.106.12.https > 165.22.226.164.33010: Flags [P.], seq 1099:1642, ack 570, win 6146, options [nop,nop,TS val 3720059868 ecr 608106589], length 543
09:04:53.676858 IP 165.22.226.164.33010 > 104.248.106.12.https: Flags [P.], seq 570:611, ack 1642, win 501, options [nop,nop,TS val 608106595 ecr 3720059868], length 41
09:04:53.676888 IP 165.22.226.164.33010 > 104.248.106.12.https: Flags [P.], seq 611:1062, ack 1642, win 501, options [nop,nop,TS val 608106595 ecr 3720059868], length 451
09:04:53.677390 IP 104.248.106.12.https > 165.22.226.164.33010: Flags [.], ack 1062, win 6146, options [nop,nop,TS val 3720059869 ecr 608106595], length 0
09:04:53.679073 IP 104.248.106.12.https > 165.22.226.164.33010: Flags [P.], seq 1642:1677, ack 1062, win 6146, options [nop,nop,TS val 3720059870 ecr 608106595], length 35
09:04:53.683420 IP 104.248.106.12.https > 165.22.226.164.33010: Flags [P.], seq 1677:2197, ack 1062, win 6146, options [nop,nop,TS val 3720059875 ecr 608106595], length 520
09:04:53.683528 IP 165.22.226.164.33010 > 104.248.106.12.https: Flags [.], ack 2197, win 501, options [nop,nop,TS val 608106601 ecr 3720059870], length 0
09:04:53.866392 IP 104.248.106.12.8132 > 165.22.226.164.38068: Flags [P.], seq 1557604436:1557604514, ack 247423779, win 2577, options [nop,nop,TS val 3054252232 ecr 250216467], length 78
09:04:53.866447 IP 104.248.106.12.8132 > 10.244.0.75.38068: Flags [P.], seq 1557604436:1557604514, ack 247423779, win 2577, options [nop,nop,TS val 3054252232 ecr 250216467], length 78
09:04:53.866480 IP 10.244.0.75.38068 > 104.248.106.12.8132: Flags [.], ack 78, win 501, options [nop,nop,TS val 250221128 ecr 3054252232], length 0
09:04:53.866505 IP 165.22.226.164.38068 > 104.248.106.12.8132: Flags [.], ack 78, win 501, options [nop,nop,TS val 250221128 ecr 3054252232], length 0
09:04:53.866779 IP 10.244.0.75.50638 > 10.118.0.2.10250: Flags [P.], seq 2870806186:2870806220, ack 161121150, win 501, options [nop,nop,TS val 3258711379 ecr 3097566804], length 34
09:04:53.866854 IP 10.244.0.75.38068 > 104.248.106.12.8132: Flags [P.], seq 1:53, ack 78, win 501, options [nop,nop,TS val 250221129 ecr 3054252232], length 52
09:04:53.866867 IP 165.22.226.164.38068 > 104.248.106.12.8132: Flags [P.], seq 1:53, ack 78, win 501, options [nop,nop,TS val 250221129 ecr 3054252232], length 52
09:04:53.867319 IP localhost.55532 > localhost.42007: Flags [P.], seq 1279122222:1279122234, ack 3541399412, win 512, options [nop,nop,TS val 2025861762 ecr 2025856749], length 12
09:04:53.867390 IP localhost.42007 > localhost.55532: Flags [P.], seq 1:3, ack 12, win 512, options [nop,nop,TS val 2025861762 ecr 2025861762], length 2
09:04:53.867398 IP localhost.55532 > localhost.42007: Flags [.], ack 3, win 512, options [nop,nop,TS val 2025861762 ecr 2025861762], length 0
09:04:53.867409 IP localhost.42007 > localhost.55532: Flags [P.], seq 3:5, ack 12, win 512, options [nop,nop,TS val 2025861762 ecr 2025861762], length 2
09:04:53.867414 IP localhost.55532 > localhost.42007: Flags [.], ack 5, win 512, options [nop,nop,TS val 2025861762 ecr 2025861762], length 0
09:04:53.867424 IP localhost.42007 > localhost.55532: Flags [P.], seq 5:9, ack 12, win 512, options [nop,nop,TS val 2025861762 ecr 2025861762], length 4
09:04:53.867427 IP localhost.55532 > localhost.42007: Flags [.], ack 9, win 512, options [nop,nop,TS val 2025861762 ecr 2025861762], length 0
09:04:53.867433 IP localhost.42007 > localhost.55532: Flags [P.], seq 9:13, ack 12, win 512, options [nop,nop,TS val 2025861762 ecr 2025861762], length 4
09:04:53.867436 IP localhost.55532 > localhost.42007: Flags [.], ack 13, win 512, options [nop,nop,TS val 2025861762 ecr 2025861762], length 0
09:04:53.867497 IP 10.118.0.2.10250 > 10.244.0.75.50638: Flags [P.], seq 1:35, ack 34, win 501, options [nop,nop,TS val 3097571816 ecr 3258711379], length 34
09:04:53.867503 IP 10.244.0.75.50638 > 10.118.0.2.10250: Flags [.], ack 35, win 501, options [nop,nop,TS val 3258711379 ecr 3097571816], length 0
09:04:53.867649 IP 10.244.0.75.38068 > 104.248.106.12.8132: Flags [P.], seq 53:131, ack 78, win 501, options [nop,nop,TS val 250221130 ecr 3054252232], length 78
09:04:53.867664 IP 165.22.226.164.38068 > 104.248.106.12.8132: Flags [P.], seq 53:131, ack 78, win 501, options [nop,nop,TS val 250221130 ecr 3054252232], length 78
09:04:53.869017 IP 104.248.106.12.8132 > 165.22.226.164.38068: Flags [.], ack 131, win 2577, options [nop,nop,TS val 3054252235 ecr 250221129], length 0
09:04:53.869040 IP 104.248.106.12.8132 > 10.244.0.75.38068: Flags [.], ack 131, win 2577, options [nop,nop,TS val 3054252235 ecr 250221129], length 0
09:04:53.876508 IP 104.248.106.12.8132 > 165.22.226.164.38068: Flags [P.], seq 78:147, ack 131, win 2577, options [nop,nop,TS val 3054252242 ecr 250221129], length 69
09:04:53.876568 IP 104.248.106.12.8132 > 10.244.0.75.38068: Flags [P.], seq 78:147, ack 131, win 2577, options [nop,nop,TS val 3054252242 ecr 250221129], length 69
09:04:53.876584 IP 10.244.0.75.38068 > 104.248.106.12.8132: Flags [.], ack 147, win 501, options [nop,nop,TS val 250221138 ecr 3054252242], length 0
09:04:53.876609 IP 165.22.226.164.38068 > 104.248.106.12.8132: Flags [.], ack 147, win 501, options [nop,nop,TS val 250221138 ecr 3054252242], length 0
09:04:53.876742 IP 10.244.0.75.38068 > 104.248.106.12.8132: Flags [P.], seq 131:170, ack 147, win 501, options [nop,nop,TS val 250221139 ecr 3054252242], length 39
09:04:53.876759 IP 165.22.226.164.38068 > 104.248.106.12.8132: Flags [P.], seq 131:170, ack 147, win 501, options [nop,nop,TS val 250221139 ecr 3054252242], length 39
09:04:53.918764 IP 104.248.106.12.8132 > 165.22.226.164.38068: Flags [.], ack 170, win 2577, options [nop,nop,TS val 3054252284 ecr 250221139], length 0
09:04:53.918811 IP 104.248.106.12.8132 > 10.244.0.75.38068: Flags [.], ack 170, win 2577, options [nop,nop,TS val 3054252284 ecr 250221139], length 0
09:04:53.949798 IP 165.22.226.164.60095 > 67.207.67.3.domain: 41537+ PTR? 75.0.244.10.in-addr.arpa. (42)
09:04:53.951094 IP 67.207.67.3.domain > 165.22.226.164.60095: 41537 NXDomain 0/1/0 (91)
09:04:54.365924 IP 10.244.0.11.42044 > 10.244.0.75.8134: Flags [S], seq 4214101502, win 64240, options [mss 1460,sackOK,TS val 3485360115 ecr 0,nop,wscale 7], length 0
09:04:54.365957 IP 10.244.0.75.8134 > 10.244.0.11.42044: Flags [S.], seq 474965389, ack 4214101503, win 65160, options [mss 1460,sackOK,TS val 1788681951 ecr 3485360115,nop,wscale 7], length 0
09:04:54.365998 IP 10.244.0.11.42044 > 10.244.0.75.8134: Flags [.], ack 1, win 502, options [nop,nop,TS val 3485360115 ecr 1788681951], length 0
09:04:54.366412 IP 10.244.0.11.42044 > 10.244.0.75.8134: Flags [P.], seq 1:111, ack 1, win 502, options [nop,nop,TS val 3485360115 ecr 1788681951], length 110
09:04:54.366428 IP 10.244.0.75.8134 > 10.244.0.11.42044: Flags [.], ack 111, win 509, options [nop,nop,TS val 1788681951 ecr 3485360115], length 0
09:04:54.366573 IP 10.244.0.75.8134 > 10.244.0.11.42044: Flags [P.], seq 1:138, ack 111, win 509, options [nop,nop,TS val 1788681951 ecr 3485360115], length 137
09:04:54.366612 IP 10.244.0.75.8134 > 10.244.0.11.42044: Flags [F.], seq 138, ack 111, win 509, options [nop,nop,TS val 1788681951 ecr 3485360115], length 0
09:04:54.366662 IP 10.244.0.11.42044 > 10.244.0.75.8134: Flags [.], ack 138, win 501, options [nop,nop,TS val 3485360116 ecr 1788681951], length 0
09:04:54.366790 IP 10.244.0.11.42044 > 10.244.0.75.8134: Flags [F.], seq 111, ack 139, win 501, options [nop,nop,TS val 3485360116 ecr 1788681951], length 0
09:04:54.366800 IP 10.244.0.75.8134 > 10.244.0.11.42044: Flags [.], ack 112, win 509, options [nop,nop,TS val 1788681952 ecr 3485360116], length 0
09:04:54.470131 IP 10.118.0.6.41356 > 10.118.0.2.10250: Flags [P.], seq 1:35, ack 279, win 4514, options [nop,nop,TS val 3460323921 ecr 29990573], length 34
09:04:54.470287 IP localhost.43096 > localhost.42007: Flags [P.], seq 1:13, ack 191, win 512, options [nop,nop,TS val 2025862365 ecr 2025858776], length 12
09:04:54.470389 IP localhost.42007 > localhost.43096: Flags [P.], seq 191:193, ack 13, win 512, options [nop,nop,TS val 2025862365 ecr 2025862365], length 2
09:04:54.470399 IP localhost.43096 > localhost.42007: Flags [.], ack 193, win 512, options [nop,nop,TS val 2025862365 ecr 2025862365], length 0
09:04:54.470487 IP localhost.42007 > localhost.43096: Flags [P.], seq 193:195, ack 13, win 512, options [nop,nop,TS val 2025862365 ecr 2025862365], length 2
09:04:54.470492 IP localhost.43096 > localhost.42007: Flags [.], ack 195, win 512, options [nop,nop,TS val 2025862365 ecr 2025862365], length 0
09:04:54.470500 IP localhost.42007 > localhost.43096: Flags [P.], seq 195:199, ack 13, win 512, options [nop,nop,TS val 2025862365 ecr 2025862365], length 4
09:04:54.470503 IP localhost.43096 > localhost.42007: Flags [.], ack 199, win 512, options [nop,nop,TS val 2025862365 ecr 2025862365], length 0
09:04:54.470510 IP localhost.42007 > localhost.43096: Flags [P.], seq 199:203, ack 13, win 512, options [nop,nop,TS val 2025862365 ecr 2025862365], length 4
09:04:54.470575 IP localhost.43096 > localhost.42007: Flags [.], ack 203, win 512, options [nop,nop,TS val 2025862365 ecr 2025862365], length 0
09:04:54.470593 IP 10.118.0.2.10250 > 10.118.0.6.41356: Flags [P.], seq 279:313, ack 35, win 501, options [nop,nop,TS val 29994162 ecr 3460323921], length 34
09:04:54.471290 IP 10.118.0.6.41356 > 10.118.0.2.10250: Flags [.], ack 313, win 4514, options [nop,nop,TS val 3460323922 ecr 29994162], length 0
09:04:54.508796 IP 10.244.1.112.51660 > 10.244.0.26.10250: Flags [P.], seq 116:293, ack 756, win 501, options [nop,nop,TS val 3770592507 ecr 46468747], length 177
09:04:54.508854 IP 10.244.1.112.51660 > 10.244.0.26.10250: Flags [P.], seq 116:293, ack 756, win 501, options [nop,nop,TS val 3770592507 ecr 46468747], length 177
09:04:54.509875 IP 10.244.0.26.10250 > 10.244.1.112.51660: Flags [P.], seq 756:844, ack 293, win 501, options [nop,nop,TS val 46470943 ecr 3770592507], length 88
09:04:54.509910 IP 10.244.0.26.10250 > 10.244.1.112.51660: Flags [P.], seq 756:844, ack 293, win 501, options [nop,nop,TS val 46470943 ecr 3770592507], length 88
09:04:54.509972 IP 10.244.0.26.10250 > 10.244.1.112.51660: Flags [P.], seq 844:1511, ack 293, win 501, options [nop,nop,TS val 46470943 ecr 3770592507], length 667
09:04:54.509980 IP 10.244.0.26.10250 > 10.244.1.112.51660: Flags [P.], seq 844:1511, ack 293, win 501, options [nop,nop,TS val 46470943 ecr 3770592507], length 667
09:04:54.510949 IP 10.244.1.112.51660 > 10.244.0.26.10250: Flags [.], ack 844, win 501, options [nop,nop,TS val 3770592509 ecr 46470943], length 0
09:04:54.510987 IP 10.244.1.112.51660 > 10.244.0.26.10250: Flags [.], ack 844, win 501, options [nop,nop,TS val 3770592509 ecr 46470943], length 0
09:04:54.511015 IP 10.244.1.112.51660 > 10.244.0.26.10250: Flags [.], ack 1511, win 497, options [nop,nop,TS val 3770592509 ecr 46470943], length 0
09:04:54.511019 IP 10.244.1.112.51660 > 10.244.0.26.10250: Flags [.], ack 1511, win 497, options [nop,nop,TS val 3770592509 ecr 46470943], length 0
09:04:54.572285 IP 10.244.0.11.43790 > 10.244.0.103.8181: Flags [S], seq 927214681, win 64240, options [mss 1460,sackOK,TS val 1595398411 ecr 0,nop,wscale 7], length 0
09:04:54.572319 IP 10.244.0.103.8181 > 10.244.0.11.43790: Flags [S.], seq 268830018, ack 927214682, win 65160, options [mss 1460,sackOK,TS val 401617495 ecr 1595398411,nop,wscale 7], length 0
09:04:54.572375 IP 10.244.0.11.43790 > 10.244.0.103.8181: Flags [.], ack 1, win 502, options [nop,nop,TS val 1595398411 ecr 401617495], length 0
09:04:54.572979 IP 10.244.0.11.43790 > 10.244.0.103.8181: Flags [P.], seq 1:110, ack 1, win 502, options [nop,nop,TS val 1595398412 ecr 401617495], length 109
09:04:54.572994 IP 10.244.0.103.8181 > 10.244.0.11.43790: Flags [.], ack 110, win 509, options [nop,nop,TS val 401617496 ecr 1595398412], length 0
09:04:54.573239 IP 10.244.0.103.8181 > 10.244.0.11.43790: Flags [P.], seq 1:138, ack 110, win 509, options [nop,nop,TS val 401617496 ecr 1595398412], length 137
09:04:54.573353 IP 10.244.0.103.8181 > 10.244.0.11.43790: Flags [F.], seq 138, ack 110, win 509, options [nop,nop,TS val 401617496 ecr 1595398412], length 0
09:04:54.573438 IP 10.244.0.11.43790 > 10.244.0.103.8181: Flags [.], ack 138, win 501, options [nop,nop,TS val 1595398412 ecr 401617496], length 0
09:04:54.573645 IP 10.244.0.11.43790 > 10.244.0.103.8181: Flags [F.], seq 110, ack 139, win 501, options [nop,nop,TS val 1595398413 ecr 401617496], length 0
09:04:54.573653 IP 10.244.0.103.8181 > 10.244.0.11.43790: Flags [.], ack 111, win 509, options [nop,nop,TS val 401617497 ecr 1595398413], length 0
09:04:54.800446 IP 10.118.0.4.49036 > 10.118.0.2.31145: Flags [S], seq 2800881982, win 64240, options [mss 1460,sackOK,TS val 2091139058 ecr 0,nop,wscale 7], length 0
09:04:54.800506 IP 10.118.0.2.26674 > 10.244.1.22.http: Flags [S], seq 2800881982, win 64240, options [mss 1460,sackOK,TS val 2091139058 ecr 0,nop,wscale 7], length 0
09:04:54.801317 IP 10.244.1.22.http > 10.118.0.2.26674: Flags [S.], seq 2821752325, ack 2800881983, win 65160, options [mss 1460,sackOK,TS val 515978982 ecr 2091139058,nop,wscale 7], length 0
